-- phpMyAdmin SQL Dump
-- version 5.1.1
-- https://www.phpmyadmin.net/
--
-- Host: 127.0.0.1:3306
-- Generation Time: Nov 27, 2022 at 11:17 AM
-- Server version: 10.5.13-MariaDB-cll-lve
-- PHP Version: 7.2.34

SET SQL_MODE = "NO_AUTO_VALUE_ON_ZERO";
START TRANSACTION;
SET time_zone = "+00:00";


/*!40101 SET @OLD_CHARACTER_SET_CLIENT=@@CHARACTER_SET_CLIENT */;
/*!40101 SET @OLD_CHARACTER_SET_RESULTS=@@CHARACTER_SET_RESULTS */;
/*!40101 SET @OLD_COLLATION_CONNECTION=@@COLLATION_CONNECTION */;
/*!40101 SET NAMES utf8mb4 */;

--
-- Database: `u231784203_spadb`
--

-- --------------------------------------------------------

--
-- Table structure for table `admin_spa_login`
--

CREATE TABLE `admin_spa_login` (
  `id` int(11) NOT NULL,
  `admin_username` varchar(100) COLLATE utf8mb4_unicode_ci DEFAULT NULL,
  `admin_password` varchar(100) COLLATE utf8mb4_unicode_ci DEFAULT NULL,
  `roles` varchar(20) COLLATE utf8mb4_unicode_ci DEFAULT NULL,
  `date` datetime DEFAULT NULL,
  `status` varchar(15) COLLATE utf8mb4_unicode_ci DEFAULT NULL
) ENGINE=InnoDB DEFAULT CHARSET=utf8mb4 COLLATE=utf8mb4_unicode_ci;

--
-- Dumping data for table `admin_spa_login`
--

INSERT INTO `admin_spa_login` (`id`, `admin_username`, `admin_password`, `roles`, `date`, `status`) VALUES
(100, 'spa_admin', 'spa_admin@0003', 'admin', '2022-04-09 21:39:51', 'active');

-- --------------------------------------------------------

--
-- Table structure for table `book_appointment`
--

CREATE TABLE `book_appointment` (
  `id` int(11) NOT NULL,
  `name` varchar(50) COLLATE utf8mb4_unicode_ci DEFAULT NULL,
  `email` varchar(100) COLLATE utf8mb4_unicode_ci DEFAULT NULL,
  `contact` varchar(12) COLLATE utf8mb4_unicode_ci DEFAULT NULL,
  `service_name` varchar(5000) COLLATE utf8mb4_unicode_ci DEFAULT NULL,
  `serviceDate` varchar(50) COLLATE utf8mb4_unicode_ci DEFAULT NULL,
  `serviceTiming` varchar(50) COLLATE utf8mb4_unicode_ci DEFAULT NULL,
  `serviceAt` varchar(50) COLLATE utf8mb4_unicode_ci DEFAULT NULL,
  `message` varchar(1000) COLLATE utf8mb4_unicode_ci DEFAULT NULL,
  `amount` varchar(10) COLLATE utf8mb4_unicode_ci DEFAULT NULL,
  `paymentMode` varchar(50) COLLATE utf8mb4_unicode_ci DEFAULT NULL,
  `bookingStatus` varchar(50) COLLATE utf8mb4_unicode_ci DEFAULT NULL,
  `reason` varchar(50) COLLATE utf8mb4_unicode_ci DEFAULT NULL,
  `service_id` int(11) DEFAULT NULL,
  `partners_admin_id` int(11) DEFAULT NULL,
  `date` datetime DEFAULT NULL,
  `customer_address` varchar(500) COLLATE utf8mb4_unicode_ci NOT NULL,
  `cust_address_id` int(11) NOT NULL,
  `session_id` varchar(100) COLLATE utf8mb4_unicode_ci DEFAULT NULL,
  `paymentStatus` varchar(100) COLLATE utf8mb4_unicode_ci DEFAULT NULL,
  `orderId` int(11) DEFAULT NULL,
  `cust_username` varchar(10) COLLATE utf8mb4_unicode_ci DEFAULT NULL,
  `cust_id` int(11) DEFAULT NULL,
  `isassigned` varchar(10) COLLATE utf8mb4_unicode_ci DEFAULT NULL,
  `assign_partner_id` int(11) DEFAULT NULL,
  `assign_partner_name` varchar(50) COLLATE utf8mb4_unicode_ci DEFAULT NULL,
  `canceled_order_by_admin` varchar(20) COLLATE utf8mb4_unicode_ci DEFAULT NULL,
  `canceled_order_by_customer` varchar(20) COLLATE utf8mb4_unicode_ci DEFAULT NULL,
  `cust_reason` varchar(2000) COLLATE utf8mb4_unicode_ci DEFAULT NULL,
  `admin_reason` varchar(2000) COLLATE utf8mb4_unicode_ci DEFAULT NULL,
  `canceled_datetime` datetime DEFAULT NULL,
  `isreschedule` varchar(10) COLLATE utf8mb4_unicode_ci DEFAULT NULL,
  `rescheduleDate` varchar(30) COLLATE utf8mb4_unicode_ci DEFAULT NULL,
  `rescheduleTime` varchar(30) COLLATE utf8mb4_unicode_ci DEFAULT NULL,
  `convenienceFee` decimal(6,2) DEFAULT NULL
) ENGINE=InnoDB DEFAULT CHARSET=utf8mb4 COLLATE=utf8mb4_unicode_ci;

--
-- Dumping data for table `book_appointment`
--

INSERT INTO `book_appointment` (`id`, `name`, `email`, `contact`, `service_name`, `serviceDate`, `serviceTiming`, `serviceAt`, `message`, `amount`, `paymentMode`, `bookingStatus`, `reason`, `service_id`, `partners_admin_id`, `date`, `customer_address`, `cust_address_id`, `session_id`, `paymentStatus`, `orderId`, `cust_username`, `cust_id`, `isassigned`, `assign_partner_id`, `assign_partner_name`, `canceled_order_by_admin`, `canceled_order_by_customer`, `cust_reason`, `admin_reason`, `canceled_datetime`, `isreschedule`, `rescheduleDate`, `rescheduleTime`, `convenienceFee`) VALUES
(1001, 'dharmender kumar', 'dharmendervalmikiprasad@gmail.com', '8700373993', '{\"2\":{\"cart_id\":\"2\",\"service_id\":\"1045\",\"session_id\":\"d8ba4062411e38c0fcf9ae4970a149d6\",\"quantity\":\"1\",\"amount\":\"2\",\"offers\":\"5\"}}', '30-09-2022', '06:30PM-07:00PM', '', 'Need ', '1.9', 'Online', 'pending', '', 1, 100, '2022-09-30 15:14:56', 'dharmender kumar, Noida sector 12 block A47, Noida , 12-22, Noida , Uttar Pradesh - 201301 + Add New Address, Noida, Morher , Noida , Uttar Pradesh - 201301', 1016, 'd8ba4062411e38c0fcf9ae4970a149d6', 'pending', NULL, '8700373993', 1005, 'false', NULL, NULL, 'false', 'false', NULL, NULL, NULL, 'false', NULL, NULL, NULL),
(1002, 'virat shrivastav', 'viratchoice7417@gmail.com', '7417636384', '{\"3\":{\"cart_id\":\"3\",\"service_id\":\"1045\",\"session_id\":\"6086f95a364d615ac1a5af55c696e68f\",\"quantity\":\"1\",\"amount\":\"2\",\"offers\":\"5\"}}', '30-09-2022', '06:00PM-06:30PM', '', '', '1.9', 'Online', 'pending', '', 1, 100, '2022-09-30 15:21:19', 'virat shrivastav, Harkesh Nagar Colony, tilpat Faridabad , Harkesh Nagar Colony , H.K public school , Faridabad , Haryana - 121003', 1017, '6086f95a364d615ac1a5af55c696e68f', 'pending', NULL, '7417636384', 1004, 'false', NULL, NULL, 'false', 'false', NULL, NULL, NULL, 'false', NULL, NULL, NULL),
(1003, 'virat shrivastav', 'viratchoice7417@gmail.com', '7417636384', '{\"3\":{\"cart_id\":\"3\",\"service_id\":\"1045\",\"session_id\":\"6086f95a364d615ac1a5af55c696e68f\",\"quantity\":\"1\",\"amount\":\"2\",\"offers\":\"5\"}}', '30-09-2022', NULL, '', '', '1.9', 'Cash On Service', 'pending', '', 1, 100, '2022-09-30 15:23:14', 'virat shrivastav, Harkesh Nagar Colony, tilpat Faridabad , Harkesh Nagar Colony , H.K public school , Faridabad , Haryana - 121003', 1017, '6086f95a364d615ac1a5af55c696e68f', 'pending', NULL, '7417636384', 1004, 'false', NULL, NULL, 'false', 'false', NULL, NULL, NULL, 'false', NULL, NULL, NULL),
(1004, 'virat shrivastav', 'viratchoice7417@gmail.com', '7417636384', '{\"3\":{\"cart_id\":\"3\",\"service_id\":\"1045\",\"session_id\":\"6086f95a364d615ac1a5af55c696e68f\",\"quantity\":\"1\",\"amount\":\"2\",\"offers\":\"5\"}}', '30-09-2022', '06:30PM-07:00PM', '', 'Kindly visit on time ', '1.9', 'Cash On Service', 'pending', '', 1, 100, '2022-09-30 15:23:55', 'virat shrivastav, Harkesh Nagar Colony, tilpat Faridabad , Harkesh Nagar Colony , H.K public school , Faridabad , Haryana - 121003', 1017, '6086f95a364d615ac1a5af55c696e68f', 'Cash On Service', 100004, '7417636384', 1004, 'false', NULL, NULL, 'false', 'true', 'Order by Mistake', NULL, '2022-11-14 10:59:21', 'false', NULL, NULL, NULL),
(1005, 'virat shrivastav', 'viratchoice7417@gmail.com', '7417636384', NULL, '30-09-2022', '06:30PM-07:00PM', '', 'Kindly visit on time ', '0', 'Online', 'pending', '', 1, 100, '2022-09-30 15:25:10', 'virat shrivastav, Harkesh Nagar Colony, tilpat Faridabad , Harkesh Nagar Colony , H.K public school , Faridabad , Haryana - 121003', 1017, '6086f95a364d615ac1a5af55c696e68f', 'pending', NULL, '7417636384', 1004, 'false', NULL, NULL, 'false', 'false', NULL, NULL, NULL, 'false', NULL, NULL, NULL),
(1006, 'virat shrivastav', 'viratchoice7417@gmail.com', '7417636384', '{\"7\":{\"cart_id\":\"7\",\"service_id\":\"1045\",\"session_id\":\"6086f95a364d615ac1a5af55c696e68f\",\"quantity\":\"1\",\"amount\":\"2\",\"offers\":\"5\"}}', '30-09-2022', '07:00PM-07:30PM', '', '', '1.9', 'Online', 'pending', '', 1, 100, '2022-09-30 15:27:36', 'virat shrivastav, Harkesh Nagar Colony, tilpat Faridabad , Harkesh Nagar Colony , H.K public school , Faridabad , Haryana - 121003', 1017, '6086f95a364d615ac1a5af55c696e68f', 'pending', NULL, '7417636384', 1004, 'false', NULL, NULL, 'false', 'false', NULL, NULL, NULL, 'false', NULL, NULL, NULL),
(1007, 'Amit Gupta', 'amitgupta1703@gmail.com', '9450715497', '{\"5\":{\"cart_id\":\"5\",\"service_id\":\"1078\",\"session_id\":\"3e8fbe672bf89239a8120d7f442c677b\",\"quantity\":\"1\",\"amount\":\"999\",\"offers\":\"20\"}}', '30-09-2022', '08:00PM-08:30PM', '', '', '799.2', 'Cash On Service', 'pending', '', 1, 100, '2022-09-30 23:52:07', 'Amit Kumar Gupta, 56-h, Noida, Noida, Uttar Pradesh - 201301', 1001, '3e8fbe672bf89239a8120d7f442c677b', 'Cash On Service Delivery', 100009, '9450715497', 1001, 'false', NULL, NULL, 'false', 'false', NULL, NULL, NULL, 'false', NULL, NULL, NULL),
(1008, 'Amit Gupta', 'amitgupta1703@gmail.com', '9450715497', '{\"12\":{\"cart_id\":\"12\",\"service_id\":\"1078\",\"session_id\":\"3e8fbe672bf89239a8120d7f442c677b\",\"quantity\":\"1\",\"amount\":\"999\",\"offers\":\"20\"}}', '01-10-2022', '02:00PM-02:30PM', '', '', '839.2', 'Cash On Service', 'pending', '', 1, 100, '2022-10-01 00:26:40', 'Amit Gupta, Sector 32, Noida, Noida, Gautam Buddh Nagar, Uttar Pradesh - 201301', 1000, '3e8fbe672bf89239a8120d7f442c677b', 'Cash On Service Delivery', 100010, '9450715497', 1001, 'false', NULL, NULL, 'false', 'false', NULL, NULL, NULL, 'false', NULL, NULL, '40.00'),
(1009, 'Amit Gupta', 'amitgupta1703@gmail.com', '9450715497', '{\"13\":{\"cart_id\":\"13\",\"service_id\":\"1077\",\"session_id\":\"3e8fbe672bf89239a8120d7f442c677b\",\"quantity\":\"1\",\"amount\":\"899\",\"offers\":\"50\"}}', '02-10-2022', '04:00PM-04:30PM', '', '', '471.5', 'Cash On Service', 'pending', '', 1, 100, '2022-10-01 00:32:23', 'Amit Kumar Gupta, 56-h, Noida, Noida, Uttar Pradesh - 201301', 1001, '3e8fbe672bf89239a8120d7f442c677b', 'Cash On Service Delivery', 100011, '9450715497', 1001, 'false', NULL, NULL, 'false', 'false', NULL, NULL, NULL, 'false', NULL, NULL, '22.00'),
(1010, 'Amit Prasad', 'prasad.amit075@gmail.com', '8130815429', '{\"11\":{\"cart_id\":\"11\",\"service_id\":\"1063\",\"session_id\":\"955cc734156e6c5ea5c5642de862dc13\",\"quantity\":\"1\",\"amount\":\"1299\",\"offers\":\"40\"}}', '03-10-2022', '10:00AM-10:30AM', '', 'Hi', '818.4', 'Cash On Service', 'pending', '', 1, 100, '2022-10-01 00:56:01', 'Ak, Noida, Noida, Mother, Noida, Uttar Pradesh - 201301', 1019, '955cc734156e6c5ea5c5642de862dc13', 'Cash On Service Delivery', 100013, '8130815429', 1010, 'false', NULL, NULL, 'false', 'false', NULL, NULL, NULL, 'false', NULL, NULL, '39.00'),
(1011, 'Amit Prasad', 'prasad.amit075@gmail.com', '8130815429', NULL, '03-10-2022', '10:00AM-10:30AM', '', 'Hi', '0', 'Cash On Service', 'pending', '', 1, 100, '2022-10-01 00:56:35', 'Ak, Noida, Noida, Mother, Noida, Uttar Pradesh - 201301', 1019, '955cc734156e6c5ea5c5642de862dc13', 'Cash On Service Delivery', 100015, '8130815429', 1010, 'false', NULL, NULL, 'false', 'false', NULL, NULL, NULL, 'false', NULL, NULL, '0.00'),
(1012, 'Amit Prasad', 'prasad.amit075@gmail.com', '8130815429', '{\"14\":{\"cart_id\":\"14\",\"service_id\":\"1093\",\"session_id\":\"955cc734156e6c5ea5c5642de862dc13\",\"quantity\":\"1\",\"amount\":\"1499\",\"offers\":\"25\"}}', '05-10-2022', '10:00AM-10:30AM', '', 'Hi', '1180.25', 'Cash On Service', 'pending', '', 1, 100, '2022-10-01 00:58:44', 'Ak, Noida, Noida, Mother, Noida, Uttar Pradesh - 201301', 1019, '955cc734156e6c5ea5c5642de862dc13', 'Cash On Service Delivery', 100017, '8130815429', 1010, 'false', NULL, NULL, 'false', 'false', NULL, NULL, NULL, 'false', NULL, NULL, '56.00'),
(1013, 'Ravinder ', 'ravindersinghkumar0021@gmail.com', '8527664317', '{\"18\":{\"cart_id\":\"18\",\"service_id\":\"1045\",\"session_id\":\"c4ce0b8034bb3f91c0f3712d3664d908\",\"quantity\":\"1\",\"amount\":\"2\",\"offers\":\"5\"}}', '01-10-2022', NULL, '', 'Head massage', '1.9', 'Cash On Service', 'pending', '', 1, 100, '2022-10-01 08:55:21', 'Ravinder, Dwarka sector 12, New delhi, New Delhi, Delhi - 110058', 1014, 'c4ce0b8034bb3f91c0f3712d3664d908', 'Cash On Service Delivery', 100019, '8527664317', 1011, 'false', NULL, NULL, 'false', 'false', NULL, NULL, NULL, 'false', NULL, NULL, '0.00'),
(1014, 'Amit Prasad', 'prasad.amit075@gmail.com', '8130815429', '{\"19\":{\"cart_id\":\"19\",\"service_id\":\"1080\",\"session_id\":\"6e6deb3badffd391010102f4b54cad06\",\"quantity\":\"1\",\"amount\":\"699\",\"offers\":\"50\"}}', '03-10-2022', '07:00PM-07:30PM', '', 'h', '366.5', 'Cash On Service', 'pending', '', 1, 100, '2022-10-01 14:17:28', 'Ak, Noida, Noida, Mother, Noida, Uttar Pradesh - 201301', 1019, '6e6deb3badffd391010102f4b54cad06', 'Cash On Service Delivery', 100020, '8130815429', 1010, 'false', NULL, NULL, 'false', 'false', NULL, NULL, NULL, 'false', NULL, NULL, '17.00'),
(1015, 'Ravinder ', 'ravindersinghkumar0021@gmail.com', '8527664317', '{\"21\":{\"cart_id\":\"21\",\"service_id\":\"1045\",\"session_id\":\"758afb68168527cb872e4cf76e1a5b8a\",\"quantity\":\"1\",\"amount\":\"2\",\"offers\":\"5\"}}', '04-10-2022', '08:00AM-08:30AM', '', 'Head massage', '1.9', 'Cash On Service', 'pending', '', 1, 100, '2022-10-01 15:27:44', 'Ravinder, Dwarka sector 12, New delhi, New Delhi, Delhi - 110058', 1014, '758afb68168527cb872e4cf76e1a5b8a', 'Cash On Service Delivery', 100021, '8527664317', 1011, 'false', NULL, NULL, 'false', 'false', NULL, NULL, NULL, 'false', NULL, NULL, '0.00'),
(1016, 'Simmi Khan', 'simmikhan.9911@gmail.com', '9971483653', '{\"22\":{\"cart_id\":\"22\",\"service_id\":\"1064\",\"session_id\":\"f34bba46387e94fd220db1ba97926106\",\"quantity\":\"1\",\"amount\":\"2499\",\"offers\":\"25\"}}', '04-10-2022', '12:30PM-01:00PM', '', 'Hi', '1949.25', 'Cash On Service', 'pending', '', 1, 100, '2022-10-01 16:30:55', 'Simmi Khan, New Delhi , Delhi , Mother , Delhi, Delhi - 110085', 1020, 'f34bba46387e94fd220db1ba97926106', 'Cash On Service Delivery', 100022, '9971483653', 1015, 'false', NULL, NULL, 'false', 'false', NULL, NULL, NULL, 'false', NULL, NULL, '75.00'),
(1017, 'Simi', 'ss9482999@gmail.com', '8130859006', '{\"32\":{\"cart_id\":\"32\",\"service_id\":\"1036\",\"session_id\":\"c67da90ad9c0da1cc4afc7d6d4cca24c\",\"quantity\":\"1\",\"amount\":\"699\",\"offers\":\"50\"}}', '03-10-2022', '11:00AM-11:30AM', '', 'Head', '366.5', 'Cash On Service', 'pending', '', 1, 100, '2022-10-01 21:04:22', 'Simi, H.no 705 bhim nagar, New railway road , Bank of India , Gurgaon , Haryana - 122022', 1021, 'c67da90ad9c0da1cc4afc7d6d4cca24c', 'Cash On Service Delivery', 100024, '8130859006', 1018, 'false', NULL, NULL, 'false', 'true', 'Urgent work', NULL, '2022-10-06 14:57:20', 'false', NULL, NULL, '17.00'),
(1018, 'Ravinder ', 'ravindersinghkumar0021@gmail.com', '8527664317', '{\"34\":{\"cart_id\":\"34\",\"service_id\":\"1045\",\"session_id\":\"50de582ef0a5cd68b5239ff3240a0d41\",\"quantity\":\"1\",\"amount\":\"2\",\"offers\":\"5\"}}', '04-10-2022', '08:00AM-08:30AM', '', '', '1.9', 'Cash On Service', 'pending', '', 1, 100, '2022-10-01 23:44:40', 'Ravinder, Dwarka sector 12, New delhi, New Delhi, Delhi - 110058', 1014, '50de582ef0a5cd68b5239ff3240a0d41', 'Cash On Service Delivery', 100026, '8527664317', 1011, 'false', NULL, NULL, 'false', 'false', NULL, NULL, NULL, 'false', NULL, NULL, '0.00'),
(1019, 'dharmender kumar', 'dharmendervalmikiprasad@gmail.com', '8700373993', '[{\"cart_id\":\"2\",\"service_id\":\"1045\",\"session_id\":\"d8ba4062411e38c0fcf9ae4970a149d6\",\"quantity\":\"1\",\"amount\":\"2\",\"offers\":\"5\"},{\"cart_id\":\"38\",\"service_id\":\"1071\",\"session_id\":\"d8ba4062411e38c0fcf9ae4970a149d6\",\"quantity\":\"1\",\"amount\":\"2599\",\"offers\":\"30\"}]', '03-10-2022', '10:00AM-10:30AM', '', 'Hi', '1894.2', 'Cash On Service', 'pending', '', 1, 100, '2022-10-02 11:02:11', 'dharmender kumar, Noida sector 12 block A47 , Noida , 12\\\\\\\'22, Noida , Uttar Pradesh - 201301', 1018, 'd8ba4062411e38c0fcf9ae4970a149d6', 'Cash On Service Delivery', 100027, '8700373993', 1005, 'false', NULL, NULL, 'false', 'false', NULL, NULL, NULL, 'false', NULL, NULL, '73.00'),
(1020, 'Sunil ', 'sunilgitm@gmail.com', '9958805622', '{\"43\":{\"cart_id\":\"43\",\"service_id\":\"1081\",\"session_id\":\"8a23ec03972541162d52737a0031c27f\",\"quantity\":\"1\",\"amount\":\"899\",\"offers\":\"50\"}}', '02-10-2022', '06:30PM-07:00PM', '', '', '471.5', 'Cash On Service', 'pending', '', 1, 100, '2022-10-02 14:01:36', 'sunil, noida sector 5, noida, durga manidr, noida, Uttar Pradesh - 201301', 1003, '8a23ec03972541162d52737a0031c27f', 'pending', NULL, '9958805622', 1023, 'false', NULL, NULL, 'false', 'false', NULL, NULL, NULL, 'false', NULL, NULL, '22.00'),
(1021, 'Sunil ', 'sunilgitm@gmail.com', '9958805622', '[{\"cart_id\":\"43\",\"service_id\":\"1081\",\"session_id\":\"8a23ec03972541162d52737a0031c27f\",\"quantity\":\"1\",\"amount\":\"899\",\"offers\":\"50\"},{\"cart_id\":\"44\",\"service_id\":\"1064\",\"session_id\":\"8a23ec03972541162d52737a0031c27f\",\"quantity\":\"1\",\"amount\":\"2499\",\"offers\":\"25\"}]', '02-10-2022', '06:00PM-06:30PM', '', '', '2416.75', 'Cash On Service', 'pending', '', 1, 100, '2022-10-02 14:05:29', 'sunil, noida sector 5, noida, durga manidr, noida, Uttar Pradesh - 201301', 1003, '8a23ec03972541162d52737a0031c27f', 'pending', NULL, '9958805622', 1023, 'false', NULL, NULL, 'false', 'false', NULL, NULL, NULL, 'false', NULL, NULL, '93.00'),
(1022, 'Sunil ', 'sunilgitm@gmail.com', '9958805622', '[{\"cart_id\":\"43\",\"service_id\":\"1081\",\"session_id\":\"8a23ec03972541162d52737a0031c27f\",\"quantity\":\"1\",\"amount\":\"899\",\"offers\":\"50\"},{\"cart_id\":\"44\",\"service_id\":\"1064\",\"session_id\":\"8a23ec03972541162d52737a0031c27f\",\"quantity\":\"1\",\"amount\":\"2499\",\"offers\":\"25\"},{\"cart_id\":\"45\",\"service_id\":\"1081\",\"session_id\":\"55b47e99fe188ded0fbdd80defb2b8f8\",\"quantity\":\"1\",\"amount\":\"899\",\"offers\":\"50\"},{\"cart_id\":\"46\",\"service_id\":\"1096\",\"session_id\":\"55b47e99fe188ded0fbdd80defb2b8f8\",\"quantity\":\"1\",\"amount\":\"699\",\"offers\":\"50\"}]', '02-10-2022', '04:30PM-05:00PM', '', '', '3216.75', 'Cash On Service', 'pending', '', 1, 100, '2022-10-02 14:24:39', 'sunil, noida sector 5, noida, durga manidr, noida, Uttar Pradesh - 201301', 1003, '55b47e99fe188ded0fbdd80defb2b8f8', 'Cash On Service Delivery', 100030, '9958805622', 1023, 'false', NULL, NULL, 'false', 'true', 'Urgent work', NULL, '2022-10-02 16:40:55', 'false', NULL, NULL, '94.00'),
(1023, 'Akash', 'akashgupta95549@gmail.com', '6391676873', '{\"71\":{\"cart_id\":\"71\",\"service_id\":\"1045\",\"session_id\":\"7e6903f4672cbd06689f47e3a1c9a797\",\"quantity\":\"1\",\"amount\":\"2\",\"offers\":\"5\"}}', '06-10-2022', '10:00AM-10:30AM', '', 'Idid', '1.9', 'Cash On Service', 'pending', '', 1, 100, '2022-10-03 15:06:46', 'Akash, Delhi laxmi Nager, delhi, Mother Dairy, delhi, Delhi - 110085', 1011, '7e6903f4672cbd06689f47e3a1c9a797', 'Cash On Service Delivery', 100032, '6391676873', 1032, 'false', NULL, NULL, 'false', 'true', 'Order by Mistake', NULL, '2022-10-06 14:41:57', 'false', NULL, NULL, '0.00'),
(1024, 'Ravinder ', 'ravindersinghkumar0021@gmail.com', '8527664317', '{\"75\":{\"cart_id\":\"75\",\"service_id\":\"1045\",\"session_id\":\"5e9e912a357fd934e732318f93608f74\",\"quantity\":\"1\",\"amount\":\"2\",\"offers\":\"5\"}}', '04-10-2022', '08:30AM-09:00AM', '', 'Head massage', '1.9', 'Online', 'pending', '', 1, 100, '2022-10-03 18:03:52', 'Ravinder, Dwarka sector 12, New delhi, New Delhi, Delhi - 110058', 1014, '5e9e912a357fd934e732318f93608f74', 'Payment Capture successfully', 100033, '8527664317', 1011, 'false', NULL, NULL, 'false', 'false', NULL, NULL, NULL, 'false', NULL, NULL, '0.00'),
(1025, 'Abhishek Kushwaha', 'yoyosuperak@gmail.com', '6297247367', '{\"84\":{\"cart_id\":\"84\",\"service_id\":\"1045\",\"session_id\":\"401d313e55979354d9ec5e11617e8a09\",\"quantity\":\"1\",\"amount\":\"2\",\"offers\":\"5\"}}', '07-10-2022', '09:30AM-10.00AM', '', '', '1.9', 'Online', 'pending', '', 1, 100, '2022-10-05 01:09:13', 'Abhishek Kushwaha, 33/11kv substation,dabgram, Dabgram, JALPAIGURI, West Bengal - 734015', 1004, '401d313e55979354d9ec5e11617e8a09', 'pending', NULL, '6297247367', 1047, 'false', NULL, NULL, 'false', 'false', NULL, NULL, NULL, 'false', NULL, NULL, '0.00'),
(1026, 'Prashant singh ', 'prashantbbs1992@gmail.com', '9663148374', '{\"88\":{\"cart_id\":\"88\",\"service_id\":\"1063\",\"session_id\":\"32950de71bd4f3b77c2364ed4754e738\",\"quantity\":\"1\",\"amount\":\"1299\",\"offers\":\"40\"}}', '05-10-2022', '04:30PM-05:00PM', '', '', '818.4', 'Cash On Service', 'pending', '', 1, 100, '2022-10-05 14:11:51', 'Prashant singh, Flat-003 Hardik tower gali num 3 sarfabad, A squre mall, A squre mall, Noida, Uttar Pradesh - 201307', 1022, '32950de71bd4f3b77c2364ed4754e738', 'Cash On Service Delivery', 100035, '9663148374', 1053, 'false', NULL, NULL, 'false', 'false', NULL, NULL, NULL, 'false', NULL, NULL, '39.00'),
(1027, 'Simi', 'ss9482999@gmail.com', '8130859006', '{\"93\":{\"cart_id\":\"93\",\"service_id\":\"1104\",\"session_id\":\"c67da90ad9c0da1cc4afc7d6d4cca24c\",\"quantity\":\"1\",\"amount\":\"1399\",\"offers\":\"20\"}}', '06-10-2022', '03:30PM-04:00PM', '', '', '1175.2', 'Cash On Service', 'pending', '', 1, 100, '2022-10-06 13:53:26', 'Simi, H.no 705 bhim nagar, New railway road , Bank of India , Gurgaon , Haryana - 122022', 1021, 'c67da90ad9c0da1cc4afc7d6d4cca24c', 'Cash On Service Delivery', 100036, '8130859006', 1018, 'false', NULL, NULL, 'false', 'true', 'Urgent work', NULL, '2022-10-06 14:57:06', 'false', NULL, NULL, '56.00'),
(1028, 'Akash', 'akashgupta95549@gmail.com', '6391676873', '{\"95\":{\"cart_id\":\"95\",\"service_id\":\"1045\",\"session_id\":\"fce1d3d4cc46ff334326cd1523414671\",\"quantity\":\"1\",\"amount\":\"2\",\"offers\":\"5\"}}', '07-10-2022', '10:00AM-10:30AM', '', 'Ghh', '1.9', 'Online', 'pending', '', 1, 100, '2022-10-06 14:33:47', 'Akash, Delhi laxmi Nager, delhi, Mother Dairy, delhi, Delhi - 110085', 1011, 'fce1d3d4cc46ff334326cd1523414671', 'pending', NULL, '6391676873', 1032, 'false', NULL, NULL, 'false', 'false', NULL, NULL, NULL, 'false', NULL, NULL, '0.00'),
(1029, 'Akash', 'akashgupta95549@gmail.com', '6391676873', '{\"95\":{\"cart_id\":\"95\",\"service_id\":\"1045\",\"session_id\":\"fce1d3d4cc46ff334326cd1523414671\",\"quantity\":\"1\",\"amount\":\"2\",\"offers\":\"5\"}}', '07-10-2022', '10:00AM-10:30AM', '', 'Yy', '1.9', 'Online', 'pending', '', 1, 100, '2022-10-06 14:35:52', 'Akash, Delhi laxmi Nager, delhi, Mother Dairy, delhi, Delhi - 110085', 1011, '693c252a10c881634057439c16d9a442', 'pending', NULL, '6391676873', 1032, 'false', NULL, NULL, 'false', 'false', NULL, NULL, NULL, 'false', NULL, NULL, '0.00'),
(1030, 'Akash', 'akashgupta95549@gmail.com', '6391676873', '{\"95\":{\"cart_id\":\"95\",\"service_id\":\"1045\",\"session_id\":\"fce1d3d4cc46ff334326cd1523414671\",\"quantity\":\"1\",\"amount\":\"2\",\"offers\":\"5\"}}', '07-10-2022', '10:00AM-10:30AM', '', 'Yy', '1.9', 'Online', 'pending', '', 1, 100, '2022-10-06 14:36:27', 'Akash, Delhi laxmi Nager, delhi, Mother Dairy, delhi, Delhi - 110085', 1011, '693c252a10c881634057439c16d9a442', 'pending', NULL, '6391676873', 1032, 'false', NULL, NULL, 'false', 'false', NULL, NULL, NULL, 'false', NULL, NULL, '0.00'),
(1031, 'Akash', 'akashgupta95549@gmail.com', '6391676873', '{\"95\":{\"cart_id\":\"95\",\"service_id\":\"1045\",\"session_id\":\"fce1d3d4cc46ff334326cd1523414671\",\"quantity\":\"1\",\"amount\":\"2\",\"offers\":\"5\"}}', '08-10-2022', '09:00AM-09:30AM', '', '', '1.9', 'Online', 'pending', '', 1, 100, '2022-10-06 14:38:53', 'Akash, Delhi laxmi Nager, delhi, Mother Dairy, delhi, Delhi - 110085', 1011, 'ece0d7f53811651243c55263716a812f', 'pending', NULL, '6391676873', 1032, 'false', NULL, NULL, 'false', 'false', NULL, NULL, NULL, 'false', NULL, NULL, '0.00'),
(1032, 'Akash', 'akashgupta95549@gmail.com', '6391676873', '{\"95\":{\"cart_id\":\"95\",\"service_id\":\"1045\",\"session_id\":\"fce1d3d4cc46ff334326cd1523414671\",\"quantity\":\"1\",\"amount\":\"2\",\"offers\":\"5\"}}', '08-10-2022', '10:00AM-10:30AM', '', '', '1.9', 'Online', 'pending', '', 1, 100, '2022-10-06 14:45:02', 'Akash, Delhi laxmi Nager, delhi, Mother Dairy, delhi, Delhi - 110085', 1011, 'a1b7c01aeb0925aacbc181a1036fd2e2', 'pending', NULL, '6391676873', 1032, 'false', NULL, NULL, 'false', 'false', NULL, NULL, NULL, 'false', NULL, NULL, '0.00'),
(1033, 'Akash', 'akashgupta95549@gmail.com', '6391676873', '{\"95\":{\"cart_id\":\"95\",\"service_id\":\"1045\",\"session_id\":\"fce1d3d4cc46ff334326cd1523414671\",\"quantity\":\"1\",\"amount\":\"2\",\"offers\":\"5\"}}', '07-10-2022', '03:00PM-03:30PM', '', '', '1.9', 'Online', 'pending', '', 1, 100, '2022-10-06 14:47:25', 'Akash, Delhi laxmi Nager, delhi, Mother Dairy, delhi, Delhi - 110085', 1011, 'd4623f29ab0cec2f0d1c60ea412eda02', 'Payment Capture successfully', 100049, '6391676873', 1032, 'false', NULL, NULL, 'false', 'true', 'Order by Mistake', NULL, '2022-10-06 15:14:04', 'false', NULL, NULL, '0.00'),
(1034, 'Akash', 'akashgupta95549@gmail.com', '6391676873', '{\"97\":{\"cart_id\":\"97\",\"service_id\":\"1045\",\"session_id\":\"7cdbcb970f7cb0ecac980b54ed0c2877\",\"quantity\":\"1\",\"amount\":\"2\",\"offers\":\"5\"}}', '07-10-2022', '11:00AM-11:30AM', '', '', '1.9', 'Online', 'pending', '', 1, 100, '2022-10-06 14:51:05', 'Akash, Delhi laxmi Nager, delhi, Mother Dairy, delhi, Delhi - 110085', 1011, '7cdbcb970f7cb0ecac980b54ed0c2877', 'pending', NULL, '6391676873', 1032, 'false', NULL, NULL, 'false', 'false', NULL, NULL, NULL, 'false', NULL, NULL, '0.00'),
(1035, 'Akash', 'akashgupta95549@gmail.com', '6391676873', '{\"97\":{\"cart_id\":\"97\",\"service_id\":\"1045\",\"session_id\":\"7cdbcb970f7cb0ecac980b54ed0c2877\",\"quantity\":\"1\",\"amount\":\"2\",\"offers\":\"5\"}}', '08-10-2022', NULL, '', '', '1.9', 'Online', 'pending', '', 1, 100, '2022-10-06 14:57:18', 'Akash, Delhi laxmi Nager, delhi, Mother Dairy, delhi, Delhi - 110085', 1011, '7cdbcb970f7cb0ecac980b54ed0c2877', 'pending', NULL, '6391676873', 1032, 'false', NULL, NULL, 'false', 'false', NULL, NULL, NULL, 'false', NULL, NULL, '0.00'),
(1036, 'Akash', 'akashgupta95549@gmail.com', '6391676873', '{\"97\":{\"cart_id\":\"97\",\"service_id\":\"1045\",\"session_id\":\"7cdbcb970f7cb0ecac980b54ed0c2877\",\"quantity\":\"1\",\"amount\":\"2\",\"offers\":\"5\"}}', '08-10-2022', NULL, '', '', '1.9', 'Online', 'pending', '', 1, 100, '2022-10-06 14:57:33', 'Akash, Delhi laxmi Nager, delhi, Mother Dairy, delhi, Delhi - 110085', 1011, '7cdbcb970f7cb0ecac980b54ed0c2877', 'pending', NULL, '6391676873', 1032, 'false', NULL, NULL, 'false', 'false', NULL, NULL, NULL, 'false', NULL, NULL, '0.00'),
(1037, 'Akash', 'akashgupta95549@gmail.com', '6391676873', '{\"97\":{\"cart_id\":\"97\",\"service_id\":\"1045\",\"session_id\":\"7cdbcb970f7cb0ecac980b54ed0c2877\",\"quantity\":\"1\",\"amount\":\"2\",\"offers\":\"5\"}}', '09-10-2022', NULL, '', '', '1.9', 'Online', 'pending', '', 1, 100, '2022-10-06 15:10:14', 'Akash, Delhi laxmi Nager, delhi, Mother Dairy, delhi, Delhi - 110085', 1011, '62d67500ecf35978eae72c8a19256dee', 'pending', NULL, '6391676873', 1032, 'false', NULL, NULL, 'false', 'false', NULL, NULL, NULL, 'false', NULL, NULL, '0.00'),
(1038, 'Akash', 'akashgupta95549@gmail.com', '6391676873', '{\"97\":{\"cart_id\":\"97\",\"service_id\":\"1045\",\"session_id\":\"7cdbcb970f7cb0ecac980b54ed0c2877\",\"quantity\":\"1\",\"amount\":\"2\",\"offers\":\"5\"}}', '09-10-2022', NULL, '', '', '1.9', 'Online', 'pending', '', 1, 100, '2022-10-06 15:11:49', 'Akash, Delhi laxmi Nager, delhi, Mother Dairy, delhi, Delhi - 110085', 1011, '62d67500ecf35978eae72c8a19256dee', 'pending', NULL, '6391676873', 1032, 'false', NULL, NULL, 'false', 'false', NULL, NULL, NULL, 'false', NULL, NULL, '0.00'),
(1039, 'Akash', 'akashgupta95549@gmail.com', '6391676873', '{\"97\":{\"cart_id\":\"97\",\"service_id\":\"1045\",\"session_id\":\"7cdbcb970f7cb0ecac980b54ed0c2877\",\"quantity\":\"1\",\"amount\":\"2\",\"offers\":\"5\"}}', '07-10-2022', '06:30PM-07:00PM', '', '', '1.9', 'Online', 'pending', '', 1, 100, '2022-10-06 15:16:37', 'Akash, Delhi laxmi Nager, delhi, Mother Dairy, delhi, Delhi - 110085', 1011, '2e32cc02886518dcbd330f9892192306', 'Payment Capture successfully', 100065, '6391676873', 1032, 'false', NULL, NULL, 'false', 'false', NULL, NULL, NULL, 'false', NULL, NULL, '0.00'),
(1040, 'Akash', 'akashgupta95549@gmail.com', '6391676873', '{\"100\":{\"cart_id\":\"100\",\"service_id\":\"1045\",\"session_id\":\"de61a77d6db3e7dba12495a9b5889ba3\",\"quantity\":\"1\",\"amount\":\"2\",\"offers\":\"5\"}}', '07-10-2022', '09:30AM-10.00AM', '', '', '1.9', 'Online', 'pending', '', 1, 100, '2022-10-06 15:38:04', 'Akash, Delhi laxmi Nager, delhi, Mother Dairy, delhi, Delhi - 110085', 1011, 'de61a77d6db3e7dba12495a9b5889ba3', 'pending', NULL, '6391676873', 1032, 'false', NULL, NULL, 'false', 'false', NULL, NULL, NULL, 'false', NULL, NULL, '0.00'),
(1041, 'Akash', 'akashgupta95549@gmail.com', '6391676873', '{\"100\":{\"cart_id\":\"100\",\"service_id\":\"1045\",\"session_id\":\"de61a77d6db3e7dba12495a9b5889ba3\",\"quantity\":\"1\",\"amount\":\"2\",\"offers\":\"5\"}}', '09-10-2022', NULL, '', '', '1.9', 'Online', 'pending', '', 1, 100, '2022-10-06 15:42:56', 'Akash, Delhi laxmi Nager, delhi, Mother Dairy, delhi, Delhi - 110085', 1011, 'fd139441373ba0d210f0c02305d23901', 'pending', NULL, '6391676873', 1032, 'false', NULL, NULL, 'false', 'false', NULL, NULL, NULL, 'false', NULL, NULL, '0.00'),
(1042, 'Akash', 'akashgupta95549@gmail.com', '6391676873', '{\"100\":{\"cart_id\":\"100\",\"service_id\":\"1045\",\"session_id\":\"de61a77d6db3e7dba12495a9b5889ba3\",\"quantity\":\"1\",\"amount\":\"2\",\"offers\":\"5\"}}', '08-10-2022', '09:30AM-10.00AM', '', '', '1.9', 'Online', 'pending', '', 1, 100, '2022-10-06 15:53:11', 'Akash, Delhi laxmi Nager, delhi, Mother Dairy, delhi, Delhi - 110085', 1011, '9b2c4e19f4d24b0e98477ce548bf8372', 'pending', NULL, '6391676873', 1032, 'false', NULL, NULL, 'false', 'false', NULL, NULL, NULL, 'false', NULL, NULL, '0.00'),
(1043, 'Akash', 'akashgupta95549@gmail.com', '6391676873', '{\"100\":{\"cart_id\":\"100\",\"service_id\":\"1045\",\"session_id\":\"de61a77d6db3e7dba12495a9b5889ba3\",\"quantity\":\"1\",\"amount\":\"2\",\"offers\":\"5\"}}', '08-10-2022', '10:00AM-10:30AM', '', 'Cc', '1.9', 'Online', 'pending', '', 1, 100, '2022-10-06 15:59:01', 'Akash, Delhi laxmi Nager, delhi, Mother Dairy, delhi, Delhi - 110085', 1011, 'a6e49cdf2693e066b2d81d0b1227bda4', 'pending', NULL, '6391676873', 1032, 'false', NULL, NULL, 'false', 'false', NULL, NULL, NULL, 'false', NULL, NULL, '0.00'),
(1044, 'Akash', 'akashgupta95549@gmail.com', '6391676873', '{\"100\":{\"cart_id\":\"100\",\"service_id\":\"1045\",\"session_id\":\"de61a77d6db3e7dba12495a9b5889ba3\",\"quantity\":\"1\",\"amount\":\"2\",\"offers\":\"5\"}}', '08-10-2022', '10:00AM-10:30AM', '', 'Cc', '1.9', 'Online', 'pending', '', 1, 100, '2022-10-06 15:59:13', 'Akash, Delhi laxmi Nager, delhi, Mother Dairy, delhi, Delhi - 110085', 1011, 'a6e49cdf2693e066b2d81d0b1227bda4', 'pending', NULL, '6391676873', 1032, 'false', NULL, NULL, 'false', 'false', NULL, NULL, NULL, 'false', NULL, NULL, '0.00'),
(1045, 'Akash', 'akashgupta95549@gmail.com', '6391676873', '{\"100\":{\"cart_id\":\"100\",\"service_id\":\"1045\",\"session_id\":\"de61a77d6db3e7dba12495a9b5889ba3\",\"quantity\":\"1\",\"amount\":\"2\",\"offers\":\"5\"}}', '09-10-2022', '09:30AM-10.00AM', '', '', '1.9', 'Online', 'pending', '', 1, 100, '2022-10-06 16:00:53', 'Akash, Delhi laxmi Nager, delhi, Mother Dairy, delhi, Delhi - 110085', 1011, 'ad083cd12bd09f79f3d7188ada511a68', 'pending', NULL, '6391676873', 1032, 'false', NULL, NULL, 'false', 'false', NULL, NULL, NULL, 'false', NULL, NULL, '0.00'),
(1046, 'Akash', 'akashgupta95549@gmail.com', '6391676873', '{\"100\":{\"cart_id\":\"100\",\"service_id\":\"1045\",\"session_id\":\"de61a77d6db3e7dba12495a9b5889ba3\",\"quantity\":\"1\",\"amount\":\"2\",\"offers\":\"5\"}}', '07-10-2022', '10:00AM-10:30AM', '', '', '1.9', 'Online', 'pending', '', 1, 100, '2022-10-06 16:20:34', 'Akash, Delhi laxmi Nager, delhi, Mother Dairy, delhi, Delhi - 110085', 1011, '36fe6e77a978b4b04aef04077d434d0a', 'pending', NULL, '6391676873', 1032, 'false', NULL, NULL, 'false', 'false', NULL, NULL, NULL, 'false', NULL, NULL, '0.00'),
(1047, 'Akash', 'akashgupta95549@gmail.com', '6391676873', '{\"100\":{\"cart_id\":\"100\",\"service_id\":\"1045\",\"session_id\":\"de61a77d6db3e7dba12495a9b5889ba3\",\"quantity\":\"1\",\"amount\":\"2\",\"offers\":\"5\"}}', '08-10-2022', '09:30AM-10.00AM', '', '', '1.9', 'Online', 'pending', '', 1, 100, '2022-10-06 16:23:22', 'Akash, Delhi laxmi Nager, delhi, Mother Dairy, delhi, Delhi - 110085', 1011, '36fe6e77a978b4b04aef04077d434d0a', 'pending', NULL, '6391676873', 1032, 'false', NULL, NULL, 'false', 'false', NULL, NULL, NULL, 'false', NULL, NULL, '0.00'),
(1048, 'Akash', 'akashgupta95549@gmail.com', '6391676873', '{\"100\":{\"cart_id\":\"100\",\"service_id\":\"1045\",\"session_id\":\"de61a77d6db3e7dba12495a9b5889ba3\",\"quantity\":\"1\",\"amount\":\"2\",\"offers\":\"5\"}}', '08-10-2022', '10:00AM-10:30AM', '', '', '1.9', 'Online', 'pending', '', 1, 100, '2022-10-06 16:48:11', 'Akash, Delhi laxmi Nager, delhi, Mother Dairy, delhi, Delhi - 110085', 1011, 'ebe972a11006c1d91ad53abe14ee47e9', 'pending', NULL, '6391676873', 1032, 'false', NULL, NULL, 'false', 'false', NULL, NULL, NULL, 'false', NULL, NULL, '0.00'),
(1049, 'Akash', 'akashgupta95549@gmail.com', '6391676873', '{\"100\":{\"cart_id\":\"100\",\"service_id\":\"1045\",\"session_id\":\"de61a77d6db3e7dba12495a9b5889ba3\",\"quantity\":\"1\",\"amount\":\"2\",\"offers\":\"5\"}}', '09-10-2022', '09:30AM-10.00AM', '', '', '1.9', 'Online', 'pending', '', 1, 100, '2022-10-06 17:01:18', 'Akash, Delhi laxmi Nager, delhi, Mother Dairy, delhi, Delhi - 110085', 1011, '36761158fa0a7cd73cc45d2a1ef451ed', 'pending', NULL, '6391676873', 1032, 'false', NULL, NULL, 'false', 'false', NULL, NULL, NULL, 'false', NULL, NULL, '0.00'),
(1050, 'Akash', 'akashgupta95549@gmail.com', '6391676873', '{\"100\":{\"cart_id\":\"100\",\"service_id\":\"1045\",\"session_id\":\"de61a77d6db3e7dba12495a9b5889ba3\",\"quantity\":\"1\",\"amount\":\"2\",\"offers\":\"5\"}}', '09-10-2022', NULL, '', '', '1.9', 'Online', 'pending', '', 1, 100, '2022-10-06 17:06:54', 'Akash, Delhi laxmi Nager, delhi, Mother Dairy, delhi, Delhi - 110085', 1011, '066db584178011d14148eaf1e9f67af8', 'pending', NULL, '6391676873', 1032, 'false', NULL, NULL, 'false', 'false', NULL, NULL, NULL, 'false', NULL, NULL, '0.00'),
(1051, 'Akash', 'akashgupta95549@gmail.com', '6391676873', '{\"100\":{\"cart_id\":\"100\",\"service_id\":\"1045\",\"session_id\":\"de61a77d6db3e7dba12495a9b5889ba3\",\"quantity\":\"1\",\"amount\":\"2\",\"offers\":\"5\"}}', '07-10-2022', '10:00AM-10:30AM', '', '', '1.9', 'Online', 'pending', '', 1, 100, '2022-10-06 17:09:20', 'Akash, Delhi laxmi Nager, delhi, Mother Dairy, delhi, Delhi - 110085', 1011, '306774bea1f2a1e95e208f8bf691dbb9', 'pending', NULL, '6391676873', 1032, 'false', NULL, NULL, 'false', 'false', NULL, NULL, NULL, 'false', NULL, NULL, '0.00'),
(1052, 'Shubham Agarwal', 'shubham.agra87914@gmail.com', '8791422550', '{\"104\":{\"cart_id\":\"104\",\"service_id\":\"1068\",\"session_id\":\"675ac0e741586400f1c7d36f5cc75c23\",\"quantity\":\"1\",\"amount\":\"2199\",\"offers\":\"20\"}}', '08-10-2022', '11:00AM-11:30AM', '', '', '1829.2', 'Cash On Service', 'pending', '', 1, 100, '2022-10-06 19:00:35', 'Shubham Agarwal, Sulekha state, Agra, Agra, Uttar Pradesh - 282003', 1024, '675ac0e741586400f1c7d36f5cc75c23', 'Cash On Service Delivery', 100092, '8791422550', 1066, 'false', NULL, NULL, 'true', 'false', NULL, 'Service Not Available In Agra ', '2022-10-08 11:20:22', 'false', NULL, NULL, '70.00'),
(1053, 'Ravinder ', 'ravindersinghkumar0021@gmail.com', '8527664317', '{\"107\":{\"cart_id\":\"107\",\"service_id\":\"1105\",\"session_id\":\"e2f3cfc9e2d09f26d90d20cb7f8e68e9\",\"quantity\":\"1\",\"amount\":\"1399\",\"offers\":\"20\"}}', '08-10-2022', '10:00AM-10:30AM', '', 'Massage', '1175.2', 'Cash On Service', 'pending', '', 1, 100, '2022-10-07 02:48:56', 'Ravinder, Dwarka sector 12, New delhi, New Delhi, Delhi - 110058', 1014, 'e2f3cfc9e2d09f26d90d20cb7f8e68e9', 'pending', NULL, '8527664317', 1011, 'false', NULL, NULL, 'false', 'false', NULL, NULL, NULL, 'false', NULL, NULL, '56.00'),
(1054, 'Akash', 'akashgupta95549@gmail.com', '6391676873', '{\"100\":{\"cart_id\":\"100\",\"service_id\":\"1045\",\"session_id\":\"de61a77d6db3e7dba12495a9b5889ba3\",\"quantity\":\"1\",\"amount\":\"2\",\"offers\":\"5\"}}', '09-10-2022', '09:30AM-10.00AM', '', '', '1.9', 'Online', 'pending', '', 1, 100, '2022-10-07 18:45:27', 'Akash, Delhi laxmi Nager, delhi, Mother Dairy, delhi, Delhi - 110085', 1011, '189401ef577b0e861e998c3942b0f400', 'Payment Capture successfully', 100095, '6391676873', 1032, 'false', NULL, NULL, 'false', 'false', NULL, NULL, NULL, 'false', NULL, NULL, '0.00'),
(1055, 'Amit Prasad', 'prasad.amit075@gmail.com', '8130815429', '{\"119\":{\"cart_id\":\"119\",\"service_id\":\"1073\",\"session_id\":\"37496de90ca98e5f42c07dfdd9748e85\",\"quantity\":\"1\",\"amount\":\"450\",\"offers\":\"35\"}}', '08-10-2022', '11:00AM-11:30AM', '', 'Hi', '292.5', 'Online', 'pending', '', 1, 100, '2022-10-07 20:45:49', 'Ak, Noida, Noida, Mother, Noida, Uttar Pradesh - 201301', 1019, '37496de90ca98e5f42c07dfdd9748e85', 'pending', NULL, '8130815429', 1010, 'false', NULL, NULL, 'false', 'false', NULL, NULL, NULL, 'false', NULL, NULL, '0.00'),
(1056, 'Amit Prasad', 'prasad.amit075@gmail.com', '8130815429', '{\"122\":{\"cart_id\":\"122\",\"service_id\":\"1073\",\"session_id\":\"3b2ccbe3652700a0666a3b5c13b1ecf1\",\"quantity\":\"1\",\"amount\":\"5\",\"offers\":\"20\"}}', '09-10-2022', '01:00PM-01:30PM', '', 'Hi', '4', 'Online', 'pending', '', 1, 100, '2022-10-08 11:26:46', 'Ak, Noida, Noida, Mother, Noida, Uttar Pradesh - 201301', 1019, '3b2ccbe3652700a0666a3b5c13b1ecf1', 'Payment Capture successfully', 100097, '8130815429', 1010, 'false', NULL, NULL, 'false', 'false', NULL, NULL, NULL, 'false', NULL, NULL, '0.00'),
(1057, 'Amit Prasad', 'prasad.amit075@gmail.com', '8130815429', '{\"126\":{\"cart_id\":\"126\",\"service_id\":\"1073\",\"session_id\":\"17597c90904a1784b2c58f07a5ca0f59\",\"quantity\":\"1\",\"amount\":\"5\",\"offers\":\"20\"}}', '08-10-2022', '05:00PM-05:30PM', '', 'hi', '4', 'Cash On Service', 'completed', '', 1, 100, '2022-10-08 14:08:14', 'Ak, Noida, Noida, Mother, Noida, Uttar Pradesh - 201301', 1019, '17597c90904a1784b2c58f07a5ca0f59', 'Cash On Service Delivery', 100098, '8130815429', 1010, 'true', 500018, 'Viswarup Dey', 'false', 'false', NULL, NULL, NULL, 'false', NULL, NULL, '0.00'),
(1058, 'Inderdev kumar Yadav', 'yadavinderdevkumar17@gmail.com', '9891871100', '{\"128\":{\"cart_id\":\"128\",\"service_id\":\"1074\",\"session_id\":\"3bf1715e219eb5765a5f502244953e38\",\"quantity\":\"1\",\"amount\":\"899\",\"offers\":\"50\"}}', '09-10-2022', '11:00AM-11:30AM', '', '', '471.5', 'Cash On Service', 'pending', '', 1, 100, '2022-10-09 08:38:20', 'Inderdev kumar Yadav, 18/1512, Damakal kendra, Damakal kendra , Delhi, Delhi - 110006', 1025, '3bf1715e219eb5765a5f502244953e38', 'Cash On Service Delivery', 100099, '9891871100', 1073, 'false', NULL, NULL, 'false', 'false', NULL, NULL, NULL, 'false', NULL, NULL, '22.00'),
(1059, 'Ravinder ', 'ravindersinghkumar0021@gmail.com', '8527664317', '{\"143\":{\"cart_id\":\"143\",\"service_id\":\"1119\",\"session_id\":\"fa3bedf228ecc5aff929e435b75ce50b\",\"quantity\":\"1\",\"amount\":\"2199\",\"offers\":\"20\"}}', '12-10-2022', '09:30AM-10.00AM', '', 'Massage', '1829.2', 'Online', 'pending', '', 1, 100, '2022-10-09 14:58:17', 'Ravinder, Dwarka sector 12, New delhi, New Delhi, Delhi - 110058', 1014, 'fa3bedf228ecc5aff929e435b75ce50b', 'pending', NULL, '8527664317', 1011, 'false', NULL, NULL, 'false', 'false', NULL, NULL, NULL, 'false', NULL, NULL, '70.00'),
(1060, 'Jyotie ', 'rai.jyoti.g@gmail.com', '9935313476', '{\"158\":{\"cart_id\":\"158\",\"service_id\":\"1103\",\"session_id\":\"35830b804b1838d5b4f0d70d34e565f3\",\"quantity\":\"1\",\"amount\":\"999\",\"offers\":\"20\"}}', '11-10-2022', '04:00PM-04:30PM', '', '', '839.2', 'Cash On Service', 'pending', '', 1, 100, '2022-10-10 17:58:33', 'Jyotie , Jyotie Rai Type 4,House no 18,BRD Medical Campus,Gorakhpur,U.P.,273013,Doctor\\\\\\\'s colony,Infront of Community Centre 9935313476, BRD MEDICAL COLLEGE , Gorakhpur , Uttar Pradesh - 273013', 1026, '35830b804b1838d5b4f0d70d34e565f3', 'Cash On Service Delivery', 100101, '9935313476', 1105, 'false', NULL, NULL, 'true', 'false', NULL, 'Sorry We Not Providing Service In Gorakhpur  ', '2022-10-10 18:13:35', 'false', NULL, NULL, '40.00'),
(1061, 'Pawan raj', 'pawanraj23932@gmail.com', '8851434930', '{\"194\":{\"cart_id\":\"194\",\"service_id\":\"1073\",\"session_id\":\"eb268084ddd276c7e256c6d807d88b26\",\"quantity\":\"1\",\"amount\":\"500\",\"offers\":\"25\"}}', '12-10-2022', '11:30AM-12:00PM', '', '', '394', 'Cash On Service', 'pending', '', 1, 100, '2022-10-11 17:52:56', 'Pawan, A2/12 sector 11 , Sector 11 , Bata chowk , Faridabad , Haryana - 121006', 1027, 'eb268084ddd276c7e256c6d807d88b26', 'Cash On Service Delivery', 100102, '8851434930', 1064, 'false', NULL, NULL, 'false', 'true', 'Urgent work', NULL, '2022-10-11 17:54:08', 'false', NULL, NULL, '19.00'),
(1062, 'Vishal', 'drmanimgr@gmail.com', '8870415925', '{\"221\":{\"cart_id\":\"221\",\"service_id\":\"1113\",\"session_id\":\"d98c1972610cc3c25b2ca34c02e3e41f\",\"quantity\":\"1\",\"amount\":\"1450\",\"offers\":\"20\"}}', '13-10-2022', '06:00PM-06:30PM', '', '', '1218', 'Cash On Service', 'pending', '', 1, 100, '2022-10-13 07:41:58', 'Vishal , WZ 19, LANE 1 ,MEENAKSHI GARDEN NEW DELHI, Meenakshi garden , Near subash Nagar metro station gate no 3, West Delhi, Delhi - 110018', 1028, 'd98c1972610cc3c25b2ca34c02e3e41f', 'pending', NULL, '8870415925', 1119, 'false', NULL, NULL, 'false', 'false', NULL, NULL, NULL, 'false', NULL, NULL, '58.00'),
(1063, 'Jagjit Singh ', 'jagjitbenipal25@gmail.com', '7814008293', '[{\"cart_id\":\"234\",\"service_id\":\"1098\",\"session_id\":\"6e209bec064585f004deaa122a4686a9\",\"quantity\":\"1\",\"amount\":\"1399\",\"offers\":\"20\"},{\"cart_id\":\"235\",\"service_id\":\"1064\",\"session_id\":\"30bacc1ec2bdb7f9b14ca4652327ce5c\",\"quantity\":\"1\",\"amount\":\"2299\",\"offers\":\"20\"},{\"cart_id\":\"237\",\"service_id\":\"1075\",\"session_id\":\"30bacc1ec2bdb7f9b14ca4652327ce5c\",\"quantity\":\"1\",\"amount\":\"2199\",\"offers\":\"20\"}]', '16-10-2022', '12:00PM-12:30PM', '', 'Good ', '4849.6', 'Cash On Service', 'pending', '', 1, 100, '2022-10-14 21:12:35', 'Jagjit Singh , Ludhiana , Panca, Ludhiana , Ludhiana , Punjab - 141416', 1029, '30bacc1ec2bdb7f9b14ca4652327ce5c', 'Cash On Service Delivery', 100106, '7814008293', 1135, 'false', NULL, NULL, 'true', 'false', NULL, 'Sorry To Info You Not Providing Service In Ludhiana', '2022-10-14 23:07:40', 'false', NULL, NULL, '132.00'),
(1064, 'Jagjit Singh ', 'jagjitbenipal25@gmail.com', '7814008293', '{\"241\":{\"cart_id\":\"241\",\"service_id\":\"1075\",\"session_id\":\"4e47b581de3a3e28d381b65f512a6359\",\"quantity\":\"1\",\"amount\":\"2199\",\"offers\":\"20\"}}', '15-10-2022', '06:00PM-06:30PM', '', '', '1829.2', 'Cash On Service', 'pending', '', 1, 100, '2022-10-15 13:46:13', 'Jagjit Singh , Ludhiana , Panca, Ludhiana , Ludhiana , Punjab - 141416', 1030, '6a4d86fb2ab704d39dc52836c7912b80', 'Cash On Service Delivery', 100108, '7814008293', 1135, 'false', NULL, NULL, 'true', 'false', NULL, 'service not Providing in Ludhiana', '2022-10-15 13:49:46', 'false', NULL, NULL, '70.00'),
(1065, 'Jagjit Singh ', 'jagjitbenipal25@gmail.com', '7814008293', NULL, '15-10-2022', '06:00PM-06:30PM', '', '', '0', 'Online', 'pending', '', 1, 100, '2022-10-15 13:47:03', 'Jagjit Singh , Ludhiana , Panca, Ludhiana , Ludhiana , Punjab - 141416', 1030, '6a4d86fb2ab704d39dc52836c7912b80', 'pending', NULL, '7814008293', 1135, 'false', NULL, NULL, 'false', 'false', NULL, NULL, NULL, 'false', NULL, NULL, '0.00'),
(1066, 'Surender ', 'surendersahrawat2108@gmail.com', '9958664667', '{\"298\":{\"cart_id\":\"298\",\"service_id\":\"1108\",\"session_id\":\"6c389f7b5864eb43bbf7c388023f0a07\",\"quantity\":\"1\",\"amount\":\"1999\",\"offers\":\"20\"}}', 'NaN-NaN-NaN', '10:00AM-10:30AM', '', '', '1663.2', 'Cash On Service', 'pending', '', 1, 100, '2022-10-17 13:38:20', 'Surender , H.no.48/a narela road near sbi bank bawa, Bawana , Narela road , Delhi, Delhi - 110039', 1031, '6c389f7b5864eb43bbf7c388023f0a07', 'pending', NULL, '9958664667', 1142, 'false', NULL, NULL, 'false', 'false', NULL, NULL, NULL, 'false', NULL, NULL, '64.00'),
(1067, 'Surender ', 'surendersahrawat2108@gmail.com', '9958664667', '{\"298\":{\"cart_id\":\"298\",\"service_id\":\"1108\",\"session_id\":\"6c389f7b5864eb43bbf7c388023f0a07\",\"quantity\":\"1\",\"amount\":\"1999\",\"offers\":\"20\"}}', '18-10-2022', NULL, '', 'no', '1663.2', 'Cash On Service', 'completed', '', 1, 100, '2022-10-17 13:42:33', 'Surender , H.no.48/a narela road near sbi bank bawa, Bawana , Narela road , Delhi, Delhi - 110039', 1031, 'dbe62f5eba443cb388597584e9766257', 'Cash On Service Delivery', 100111, '9958664667', 1142, 'true', 500015, 'Hemraj Singh', 'false', 'false', NULL, NULL, NULL, 'false', NULL, NULL, '64.00'),
(1068, 'Dev', 'iyappandevavijay@gmail.com', '8637660499', '{\"307\":{\"cart_id\":\"307\",\"service_id\":\"1033\",\"session_id\":\"9a07c2eceac5f14f8d17171cac782e5e\",\"quantity\":\"1\",\"amount\":\"1599\",\"offers\":\"20\"}}', '18-10-2022', NULL, '', '', '1343.2', 'Cash On Service', 'pending', '', 1, 100, '2022-10-18 13:24:36', 'Dev, No 8 , Sai kriba ground floor , Pallikaranai , Pallikaranai old Eb office , Chennai , Tamil Nadu - 600100', 1032, '9a07c2eceac5f14f8d17171cac782e5e', 'Cash On Service Delivery', 100112, '8637660499', 1145, 'false', NULL, NULL, 'true', 'false', NULL, 'we not providing service in Chennai, our working location Delhi NCR Only', '2022-10-18 13:41:35', 'false', NULL, NULL, '64.00'),
(1069, 'Jyoti', 'das.jyotsna@gmail.com', '9006810282', '{\"318\":{\"cart_id\":\"318\",\"service_id\":\"1103\",\"session_id\":\"8e1518fafde1c36f3d830fbc8e13a1ac\",\"quantity\":\"1\",\"amount\":\"999\",\"offers\":\"20\"}}', '20-10-2022', NULL, '', '', '839.2', 'Cash On Service', 'pending', '', 1, 100, '2022-10-20 09:27:32', 'Jyoti, Aastha twin city,4/4 mapel block,, Hurlung,telco,, Near loyola b.ed collage, Jamshedpur,jharkhand, Jharkhand - 831004', 1033, 'e56cffa7ba3ba563154fd408825b6508', 'Cash On Service Delivery', 100114, '9006810282', 1147, 'false', NULL, NULL, 'true', 'false', NULL, 'Sorry Mam We Not Providing service in Jamshedpur . our service area \\r\\nDelhi NCR', '2022-10-20 11:17:01', 'false', NULL, NULL, '40.00'),
(1070, 'Amit Prasad', 'prasad.amit075@gmail.com', '8130815429', '{\"326\":{\"cart_id\":\"326\",\"service_id\":\"1073\",\"session_id\":\"30df121f6dccadd67266fc8922e71519\",\"quantity\":\"1\",\"amount\":\"500\",\"offers\":\"25\"}}', '22-10-2022', '04:00PM-04:30PM', '', 'hiiiiiiii', '394', 'Cash On Service', 'pending', '', 1, 100, '2022-10-21 18:20:52', 'Ak, Noida, Noida, Mother, Noida, Uttar Pradesh - 201301', 1019, '30df121f6dccadd67266fc8922e71519', 'Cash On Service Delivery', 100115, '8130815429', 1010, 'false', NULL, NULL, 'false', 'false', NULL, NULL, NULL, 'false', NULL, NULL, '19.00'),
(1071, 'dharmendra', 'dkumar.expert@gmail.com', '8802634692', '{\"340\":{\"cart_id\":\"340\",\"service_id\":\"1122\",\"session_id\":\"c967ac4dd5940084f9c36822663b5c47\",\"quantity\":\"1\",\"amount\":\"500\",\"offers\":\"25\"}}', '25-10-2022', '12:00PM-12:30PM', '', 'demo', '394', 'Cash On Service', 'pending', '', 1, 100, '2022-10-22 08:57:30', 'Dharmendra, demo, delhi, delhi, Delhi - 110096', 1034, 'c967ac4dd5940084f9c36822663b5c47', 'Cash On Service Delivery', 100116, '8802634692', 1156, 'false', NULL, NULL, 'false', 'true', 'Order by Mistake', NULL, '2022-10-25 17:58:17', 'false', NULL, NULL, '19.00'),
(1072, 'Abhi', 'abhiabhimanyu882@gmail.com', '6362661374', '{\"343\":{\"cart_id\":\"343\",\"service_id\":\"1102\",\"session_id\":\"e045af96ecfbbbc98fabac01c94c4396\",\"quantity\":\"1\",\"amount\":\"1399\",\"offers\":\"20\"}}', '22-10-2022', '02:30PM-03:00PM', '', '', '1175.2', 'Cash On Service', 'pending', '', 1, 100, '2022-10-22 12:00:41', 'Abhi, Police Station Road Shaman Arcade Apartment first floor 103, Varthur , ICICI Bank ATM next left, Varthur , Karnataka - 560087', 1035, 'e045af96ecfbbbc98fabac01c94c4396', 'Cash On Service Delivery', 100117, '6362661374', 1157, 'false', NULL, NULL, 'true', 'false', NULL, 'Sorry we not providing service in Karnataka , our working location DELHI NCR ', '2022-10-22 12:14:51', 'false', NULL, NULL, '56.00'),
(1073, 'dharmendra', 'dkumar.expert@gmail.com', '8802634692', '[{\"cart_id\":\"344\",\"service_id\":\"1133\",\"session_id\":\"c967ac4dd5940084f9c36822663b5c47\",\"quantity\":\"1\",\"amount\":\"32999\",\"offers\":\"20\"},{\"cart_id\":\"345\",\"service_id\":\"1119\",\"session_id\":\"50ee434d64443ddf5443f728c993716e\",\"quantity\":\"1\",\"amount\":\"2199\",\"offers\":\"20\"}]', '25-10-2022', '11:30AM-12:00PM', '', 'Optional', '28158.4', 'Cash On Service', 'pending', '', 1, 100, '2022-10-22 12:35:06', 'Dharmendra, demo, delhi, delhi, Delhi - 110096', 1034, '50ee434d64443ddf5443f728c993716e', 'pending', NULL, '8802634692', 1156, 'false', NULL, NULL, 'false', 'false', NULL, NULL, NULL, 'false', NULL, NULL, '0.00'),
(1074, 'dharmendra', 'dkumar.expert@gmail.com', '8802634692', '{\"345\":{\"cart_id\":\"345\",\"service_id\":\"1119\",\"session_id\":\"50ee434d64443ddf5443f728c993716e\",\"quantity\":\"1\",\"amount\":\"2199\",\"offers\":\"20\"}}', '25-10-2022', '11:00AM-11:30AM', '', 'Demo ', '1829.2', 'Cash On Service', 'pending', '', 1, 100, '2022-10-22 12:36:32', 'Dharmendra, demo, delhi, delhi, Delhi - 110096', 1034, '50ee434d64443ddf5443f728c993716e', 'Cash On Service Delivery', 100120, '8802634692', 1156, 'false', NULL, NULL, 'false', 'true', 'Order by Mistake', NULL, '2022-10-25 17:58:11', 'false', NULL, NULL, '70.00'),
(1075, 'dharmendra', 'dkumar.expert@gmail.com', '8802634692', '{\"347\":{\"cart_id\":\"347\",\"service_id\":\"1123\",\"session_id\":\"c967ac4dd5940084f9c36822663b5c47\",\"quantity\":\"1\",\"amount\":\"400\",\"offers\":\"25\"}}', '26-10-2022', '12:30PM-01:00PM', '', 'demo', '315', 'Cash On Service', 'pending', '', 1, 100, '2022-10-23 12:38:56', 'Dharmendra, demo, delhi, delhi, Delhi - 110096', 1034, 'c967ac4dd5940084f9c36822663b5c47', 'Cash On Service Delivery', 100121, '8802634692', 1156, 'false', NULL, NULL, 'false', 'true', 'Order by Mistake', NULL, '2022-10-25 17:58:04', 'false', NULL, NULL, '15.00'),
(1076, 'Nipam', 'nipamsharma23011990@gmail.com', '8447675679', '{\"385\":{\"cart_id\":\"385\",\"service_id\":\"1114\",\"session_id\":\"16663328ffc452dfb73e1fe373391018\",\"quantity\":\"1\",\"amount\":\"1950\",\"offers\":\"20\"}}', '24-10-2022', '03:30PM-04:00PM', '', 'If you able to come before you can call me ', '1622', 'Cash On Service', 'pending', '', 1, 100, '2022-10-24 13:14:14', 'Nipam , D6 uppal southend , Sector 49 , Near sai mandir , Gurgaon , Haryana - 122018', 1036, '16663328ffc452dfb73e1fe373391018', 'Cash On Service Delivery', 100122, '8447675679', 1158, 'false', NULL, NULL, 'false', 'false', NULL, NULL, NULL, 'false', NULL, NULL, '62.00'),
(1077, 'dharmendra', 'dkumar.expert@gmail.com', '8802634692', '{\"402\":{\"cart_id\":\"402\",\"service_id\":\"1123\",\"session_id\":\"0974c1721067b5d2622146664926afdd\",\"quantity\":\"1\",\"amount\":\"400\",\"offers\":\"25\"}}', '28-10-2022', '11:30AM-12:00PM', '', 'demo', '315', 'Cash On Service', 'pending', '', 1, 100, '2022-10-25 14:12:59', 'Dharmendra, demo, delhi, delhi, Delhi - 110096', 1034, '0974c1721067b5d2622146664926afdd', 'Cash On Service Delivery', 100123, '8802634692', 1156, 'false', NULL, NULL, 'false', 'true', 'Order by Mistake', NULL, '2022-10-25 17:57:59', 'false', NULL, NULL, '15.00'),
(1078, 'dharmendra', 'dkumar.expert@gmail.com', '8802634692', '{\"408\":{\"cart_id\":\"408\",\"service_id\":\"1130\",\"session_id\":\"b2f181c7a62b469956e6ac666787a2c7\",\"quantity\":\"1\",\"amount\":\"36000\",\"offers\":\"20\"}}', '27-10-2022', '10:00AM-10:30AM', '', 'Demo', '28800', 'Cash On Service', 'pending', '', 1, 100, '2022-10-25 17:56:28', 'Dharmendra, demo, delhi, delhi, Delhi - 110096', 1034, 'b2f181c7a62b469956e6ac666787a2c7', 'Cash On Service Delivery', 100124, '8802634692', 1156, 'false', NULL, NULL, 'false', 'true', 'Order by Mistake', NULL, '2022-10-25 17:57:54', 'false', NULL, NULL, '0.00'),
(1079, 'Mayank Sharma', 'mayank.sharma9640@gmail.com', '8178604049', '{\"419\":{\"cart_id\":\"419\",\"service_id\":\"1112\",\"session_id\":\"83b0f9d2ac6308a5e8614645ece8687a\",\"quantity\":\"1\",\"amount\":\"850\",\"offers\":\"20\"}}', '26-10-2022', '11:30AM-12:00PM', '', '', '714', 'Cash On Service', 'pending', '', 1, 100, '2022-10-26 09:29:57', 'Mayank Sharma, A298 upper ground house no 2 , Deep vihar , Near dominos sec 24 , Rohini , Delhi - 110042', 1039, '83b0f9d2ac6308a5e8614645ece8687a', 'Cash On Service Delivery', 100125, '8178604049', 1166, 'false', NULL, NULL, 'false', 'false', NULL, NULL, NULL, 'false', NULL, NULL, '34.00'),
(1080, 'dharmendra', 'dkumar.expert@gmail.com', '8802634692', '[{\"cart_id\":\"430\",\"service_id\":\"1131\",\"session_id\":\"485e893f14f74fa736de870381fcba61\",\"quantity\":\"1\",\"amount\":\"9999\",\"offers\":\"20\"},{\"cart_id\":\"431\",\"service_id\":\"1125\",\"session_id\":\"005fdf05d4af3bbc214ba94c0fb56c7a\",\"quantity\":\"1\",\"amount\":\"599\",\"offers\":\"20\"}]', '28-10-2022', '11:30AM-12:00PM', '', '', '8715.4', 'Cash On Service', 'pending', '', 1, 100, '2022-10-26 18:24:06', 'Dharmendra, demo, delhi, delhi, Delhi - 110096', 1034, '005fdf05d4af3bbc214ba94c0fb56c7a', 'Cash On Service Delivery', 100127, '8802634692', 1156, 'false', NULL, NULL, 'false', 'false', NULL, NULL, NULL, 'false', NULL, NULL, '237.00');
INSERT INTO `book_appointment` (`id`, `name`, `email`, `contact`, `service_name`, `serviceDate`, `serviceTiming`, `serviceAt`, `message`, `amount`, `paymentMode`, `bookingStatus`, `reason`, `service_id`, `partners_admin_id`, `date`, `customer_address`, `cust_address_id`, `session_id`, `paymentStatus`, `orderId`, `cust_username`, `cust_id`, `isassigned`, `assign_partner_id`, `assign_partner_name`, `canceled_order_by_admin`, `canceled_order_by_customer`, `cust_reason`, `admin_reason`, `canceled_datetime`, `isreschedule`, `rescheduleDate`, `rescheduleTime`, `convenienceFee`) VALUES
(1081, 'dharmendra', 'dkumar.expert@gmail.com', '8802634692', '{\"432\":{\"cart_id\":\"432\",\"service_id\":\"1114\",\"session_id\":\"005fdf05d4af3bbc214ba94c0fb56c7a\",\"quantity\":\"1\",\"amount\":\"1950\",\"offers\":\"20\"}}', '29-10-2022', '09:00AM-09:30AM', '', '', '1622', 'Cash On Service', 'pending', '', 1, 100, '2022-10-26 18:48:19', 'Dharmendra, demo, delhi, delhi, Delhi - 110096', 1034, '005fdf05d4af3bbc214ba94c0fb56c7a', 'pending', NULL, '8802634692', 1156, 'false', NULL, NULL, 'false', 'false', NULL, NULL, NULL, 'false', NULL, NULL, '62.00'),
(1082, 'dharmendra', 'dkumar.expert@gmail.com', '8802634692', '{\"445\":{\"cart_id\":\"445\",\"service_id\":\"1087\",\"session_id\":\"6befaeeaeea1eae044e5bf1e73b7c722\",\"quantity\":\"1\",\"amount\":\"1399\",\"offers\":\"20\"}}', '29-10-2022', '11:00AM-11:30AM', '', 'Demo', '1175.2', 'Cash On Service', 'pending', '', 1, 100, '2022-10-27 16:58:27', 'Dharmendra, demo, delhi, delhi, Delhi - 110096', 1034, '6befaeeaeea1eae044e5bf1e73b7c722', 'pending', NULL, '8802634692', 1156, 'false', NULL, NULL, 'false', 'false', NULL, NULL, NULL, 'false', NULL, NULL, '56.00'),
(1083, 'Saurabh', 'saurabh.aroran@gmail.com', '9650161519', '{\"453\":{\"cart_id\":\"453\",\"service_id\":\"1069\",\"session_id\":\"12fcb2fe4691be152eaff810c23b1fa1\",\"quantity\":\"1\",\"amount\":\"1599\",\"offers\":\"20\"}}', '28-10-2022', '07:00PM-07:30PM', '', '', '1343.2', 'Cash On Service', 'pending', '', 1, 100, '2022-10-27 22:11:07', 'Saurabh , A 75 3rd floor , Vikas puri, New delhi , Delhi - 110018', 1040, '12fcb2fe4691be152eaff810c23b1fa1', 'Cash On Service Delivery', 100131, '9650161519', 1171, 'false', NULL, NULL, 'false', 'false', NULL, NULL, NULL, 'false', NULL, NULL, '64.00'),
(1084, 'Binu', 'justinapaul097@gmail.com', '9790760428', '{\"481\":{\"cart_id\":\"481\",\"service_id\":\"1113\",\"session_id\":\"2468942c38e9f03b4649f77e0068ef07\",\"quantity\":\"1\",\"amount\":\"1450\",\"offers\":\"20\"}}', '28-10-2022', '03:30PM-04:00PM', '', 'Is male to male or female to male massage therapy ', '1218', 'Cash On Service', 'pending', '', 1, 100, '2022-10-28 13:05:27', 'Binu, No14, site13, Ramaiah reddy road, Rupena Agrahara, Bommanahalli police station , Near bommanahalli police station , Near mayura bakery , Bangalore , Karnataka - 560068', 1041, '2468942c38e9f03b4649f77e0068ef07', 'Cash On Service Delivery', 100132, '9790760428', 1175, 'false', NULL, NULL, 'true', 'false', NULL, 'Sorry we not provide service in Bangalore , our working area DELHI NCR  ', '2022-10-28 13:09:24', 'false', NULL, NULL, '58.00'),
(1085, 'Kumar', 'sharavan245@gmail.com', '8143872788', '{\"491\":{\"cart_id\":\"491\",\"service_id\":\"1108\",\"session_id\":\"18fbcca618aa6bb0b0e272ebf14eecd2\",\"quantity\":\"1\",\"amount\":\"1999\",\"offers\":\"20\"}}', '29-10-2022', '01:30PM-02:00PM', '', 'Massage', '1663.2', 'Cash On Service', 'pending', '', 1, 100, '2022-10-28 18:11:49', 'sharavan Kumar, U 45/41 ROOM NO 7 SECTOR 24 DLF PHASE 3 U BLOCK , Gurugrm, Haryana, Haryana - 122002', 1042, 'd66778f519a9eae41eed7ce8b5bdda0e', 'pending', NULL, '8143872788', 1177, 'false', NULL, NULL, 'false', 'false', NULL, NULL, NULL, 'false', NULL, NULL, '64.00'),
(1086, 'Kumar', 'sharavan245@gmail.com', '8143872788', '{\"491\":{\"cart_id\":\"491\",\"service_id\":\"1108\",\"session_id\":\"18fbcca618aa6bb0b0e272ebf14eecd2\",\"quantity\":\"1\",\"amount\":\"1999\",\"offers\":\"20\"}}', '29-10-2022', '01:30PM-02:00PM', '', 'Massage', '1663.2', 'Cash On Service', 'pending', '', 1, 100, '2022-10-28 18:13:25', 'sharavan Kumar, U 45/41 ROOM NO 7 SECTOR 24 DLF PHASE 3 U BLOCK , Gurugrm, Haryana, Haryana - 122002', 1042, 'd66778f519a9eae41eed7ce8b5bdda0e', 'Cash On Service Delivery', 100134, '8143872788', 1177, 'false', NULL, NULL, 'false', 'true', 'Urgent work', NULL, '2022-10-29 09:04:05', 'false', NULL, NULL, '64.00'),
(1087, 'Abhimanyu Singh', 'abhimanyu.singh21@yahoo.com', '7783895451', '{\"528\":{\"cart_id\":\"528\",\"service_id\":\"1069\",\"session_id\":\"b9a3e6149c80852984888d741f87b42c\",\"quantity\":\"1\",\"amount\":\"1599\",\"offers\":\"20\"}}', '30-10-2022', '12:00PM-12:30PM', '', 'Need Hard SPA', '1343.2', 'Cash On Service', 'pending', '', 1, 100, '2022-10-29 14:02:12', 'Abhimanyu Singh, Supertech Ecocity, Noida Sector 137, Bhutanialpha thumb, Noida, Uttar Pradesh - 201301', 1043, 'b9a3e6149c80852984888d741f87b42c', 'pending', NULL, '7783895451', 1186, 'false', NULL, NULL, 'false', 'false', NULL, NULL, NULL, 'false', NULL, NULL, '64.00'),
(1088, 'Radha', 'radha.jad12@gmail.com', '9881175146', '{\"533\":{\"cart_id\":\"533\",\"service_id\":\"1103\",\"session_id\":\"87425a8f1068f61f9d173478ad6cf7c7\",\"quantity\":\"1\",\"amount\":\"999\",\"offers\":\"20\"}}', '29-10-2022', '04:30PM-05:00PM', '', '', '839.2', 'Cash On Service', 'pending', '', 1, 100, '2022-10-29 14:29:15', 'Radha , Venky pg Hinjwadi , Hinjwadi , Pune, Maharashtra - 411057', 1044, '87425a8f1068f61f9d173478ad6cf7c7', 'Cash On Service Delivery', 100136, '9881175146', 1188, 'false', NULL, NULL, 'true', 'false', NULL, 'Sorry we not providing service in Pune .our working area Delhi NCR only', '2022-10-29 17:50:13', 'false', NULL, NULL, '40.00'),
(1089, 'Sahil ', 'bsis.vijay@gmail.com', '8851178384', '{\"560\":{\"cart_id\":\"560\",\"service_id\":\"1112\",\"session_id\":\"e5af512b55b8315ff388614d5d5804c3\",\"quantity\":\"1\",\"amount\":\"850\",\"offers\":\"20\"}}', '30-10-2022', '08:00AM-08:30AM', '', 'Cross massage ', '714', 'Cash On Service', 'pending', '', 1, 100, '2022-10-29 22:20:48', 'Sahil, Sector 3 vaishali , Vaishali , Naveen hospital , Ghaziabad , Uttar Pradesh - 201010', 1046, 'e5af512b55b8315ff388614d5d5804c3', 'pending', NULL, '8851178384', 1195, 'false', NULL, NULL, 'false', 'false', NULL, NULL, NULL, 'false', NULL, NULL, '34.00'),
(1090, 'Vijay Kumar ', 'vijaygupta19997@gmail.com', '9646420753', '{\"572\":{\"cart_id\":\"572\",\"service_id\":\"1107\",\"session_id\":\"019a57f5d2ccff4803a847f522beb36a\",\"quantity\":\"1\",\"amount\":\"1499\",\"offers\":\"20\"}}', '30-10-2022', '11:00AM-11:30AM', '', '', '1259.2', 'Cash On Service', 'pending', '', 1, 100, '2022-10-30 08:47:03', 'Vijay, 2613, Sector 46 , Gurgaon , Haryana - 122001', 1047, '019a57f5d2ccff4803a847f522beb36a', 'Cash On Service Delivery', 100138, '9646420753', 1197, 'false', NULL, NULL, 'false', 'true', 'Urgent work', NULL, '2022-10-30 09:43:13', 'false', NULL, NULL, '60.00'),
(1091, 'Shiv', 'Shivendranath80@gmail.com', '9971882244', '{\"594\":{\"cart_id\":\"594\",\"service_id\":\"1079\",\"session_id\":\"1625a0cec5e019d77f1e54e5de083517\",\"quantity\":\"1\",\"amount\":\"999\",\"offers\":\"20\"}}', '30-10-2022', NULL, '', '', '839.2', 'Cash On Service', 'pending', '', 1, 100, '2022-10-30 14:01:37', 'Shuv, C4 504, Gulmohar enclave. Rakesh marg, Ghaziabad, Uttar Pradesh - 201001', 1050, '1625a0cec5e019d77f1e54e5de083517', 'Cash On Service Delivery', 100139, '9971882244', 1201, 'false', NULL, NULL, 'false', 'false', NULL, NULL, NULL, 'false', NULL, NULL, '40.00'),
(1092, 'Shiv', 'Shivendranath80@gmail.com', '9971882244', '{\"598\":{\"cart_id\":\"598\",\"service_id\":\"1079\",\"session_id\":\"3ca11a9e106a838c94f34c7e9fa19dce\",\"quantity\":\"1\",\"amount\":\"999\",\"offers\":\"20\"}}', '30-10-2022', NULL, '', '', '839.2', 'Cash On Service', 'completed', '', 1, 100, '2022-10-30 15:38:12', 'Shuv, C4 504, Gulmohar enclave. Rakesh marg, Ghaziabad, Uttar Pradesh - 201001', 1050, '3ca11a9e106a838c94f34c7e9fa19dce', 'Cash On Service Delivery', 100140, '9971882244', 1201, 'true', 500012, 'DEEPAK KUMAR VERMA', 'false', 'false', NULL, NULL, NULL, 'false', NULL, NULL, '40.00'),
(1093, 'alex alex', 'alex.oporzp@gmail.com', '8447491895', '{\"605\":{\"cart_id\":\"605\",\"service_id\":\"1124\",\"session_id\":\"f4cf50b9cc2b8a43e5efe1e0c449353d\",\"quantity\":\"1\",\"amount\":\"1299\",\"offers\":\"20\"}}', '31-10-2022', '04:00PM-04:30PM', '', 'bgnghn', '1091.2', 'Online', 'pending', '', 1, 100, '2022-10-30 18:24:51', 'alex alex, rgfdfgjksflkdn, indian, Gurugram, Haryana - 122001', 1052, 'f4cf50b9cc2b8a43e5efe1e0c449353d', 'pending', NULL, '8447491895', 1204, 'false', NULL, NULL, 'false', 'false', NULL, NULL, NULL, 'false', NULL, NULL, '52.00'),
(1094, 'Anurag', 'nisharocks91@gmail.com', '8882717088', '{\"609\":{\"cart_id\":\"609\",\"service_id\":\"1113\",\"session_id\":\"ce158cd7b2774ab3db9127cd7e6e0277\",\"quantity\":\"1\",\"amount\":\"1450\",\"offers\":\"20\"}}', '31-10-2022', '11:30AM-12:00PM', '', '', '1218', 'Cash On Service', 'pending', '', 1, 100, '2022-10-30 21:21:57', 'Anurag, Chattarpur , Chattarpur , 100 ft, Delhi - 110074', 1053, 'ce158cd7b2774ab3db9127cd7e6e0277', 'Cash On Service Delivery', 100143, '8882717088', 1205, 'false', NULL, NULL, 'false', 'false', NULL, NULL, NULL, 'false', NULL, NULL, '58.00'),
(1095, 'dharmendra', 'dkumar.expert@gmail.com', '8802634692', '{\"624\":{\"cart_id\":\"624\",\"service_id\":\"1119\",\"session_id\":\"541e96162f8d6f13cdcce4af82dbe153\",\"quantity\":\"1\",\"amount\":\"2199\",\"offers\":\"20\"}}', '31-10-2022', '11:30AM-12:00PM', '', 'Demo', '1829.2', 'Cash On Service', 'pending', '', 1, 100, '2022-10-31 09:53:28', 'Dharmendra, demo, delhi, delhi, Delhi - 110096', 1034, '541e96162f8d6f13cdcce4af82dbe153', 'pending', NULL, '8802634692', 1156, 'false', NULL, NULL, 'false', 'false', NULL, NULL, NULL, 'false', NULL, NULL, '70.00'),
(1096, 'Rohit Gupta ', 'rgupta.7501@gmail.com', '9818750750', '{\"629\":{\"cart_id\":\"629\",\"service_id\":\"1107\",\"session_id\":\"c6fd032e3a48bb63e56008e3fa2ce594\",\"quantity\":\"1\",\"amount\":\"1499\",\"offers\":\"20\"}}', '31-10-2022', '05:00PM-05:30PM', '', '', '1259.2', 'Cash On Service', 'pending', '', 1, 100, '2022-10-31 13:50:07', 'Rohit Gupta , 79, Garhi Amrit Puri A , Nr Shivam Medicose , East of Kailash , Delhi - 110065', 1054, 'c6fd032e3a48bb63e56008e3fa2ce594', 'Cash On Service Delivery', 100147, '9818750750', 1209, 'false', NULL, NULL, 'false', 'false', NULL, NULL, NULL, 'false', NULL, NULL, '60.00'),
(1097, 'Rajat', 'rchoprablog@gmail.com', '7827405251', '{\"407\":{\"cart_id\":\"407\",\"service_id\":\"1119\",\"session_id\":\"2393addf8ca738bd3ecd4852b78cc829\",\"quantity\":\"1\",\"amount\":\"2199\",\"offers\":\"20\"}}', '31-10-2022', '05:30PM-06:00PM', '', '', '1829.2', 'Cash On Service', 'completed', '', 1, 100, '2022-10-31 14:16:43', 'Rajat, P1302 ecociti, Sector 137, Noida, Uttar Pradesh - 201301', 1055, 'd0f470442851fcd1e46d3a722e6425ab', 'Cash On Service Delivery', 100148, '7827405251', 1162, 'true', 500012, 'DEEPAK KUMAR VERMA', 'false', 'false', NULL, NULL, NULL, 'false', NULL, NULL, '70.00'),
(1098, 'vikrant', 'akashsingal90@gmail.com', '9971373000', '{\"632\":{\"cart_id\":\"632\",\"service_id\":\"1119\",\"session_id\":\"46540f84f50c88b238a96eb1b335c29b\",\"quantity\":\"1\",\"amount\":\"2199\",\"offers\":\"20\"}}', '31-10-2022', '07:00PM-07:30PM', '', '', '1829.2', 'Cash On Service', 'pending', '', 1, 100, '2022-10-31 15:26:35', 'vikrant, b 1410, shastri nagar, delhi, Delhi - 110052', 1056, '46540f84f50c88b238a96eb1b335c29b', 'pending', NULL, '9971373000', 1211, 'false', NULL, NULL, 'false', 'false', NULL, NULL, NULL, 'false', NULL, NULL, '70.00'),
(1099, 'Ajay ', 'ajayendrapal88@gmail.com', '7738081038', '{\"633\":{\"cart_id\":\"633\",\"service_id\":\"1108\",\"session_id\":\"ecbe0a9de83d9356a2b41b8f89fe328c\",\"quantity\":\"1\",\"amount\":\"1999\",\"offers\":\"20\"}}', '31-10-2022', NULL, '', '', '1663.2', 'Cash On Service', 'completed', '', 1, 100, '2022-10-31 15:47:15', 'Ajay, R 183, DLF ULTIMA SECTOR 81 , Gurgaon , Gurgaon, Haryana - 122004', 1057, 'ecbe0a9de83d9356a2b41b8f89fe328c', 'Cash On Service Delivery', 100150, '7738081038', 1210, 'true', 500011, '', 'false', 'false', NULL, NULL, NULL, 'false', NULL, NULL, '64.00'),
(1100, 'Uday', 'udaygoel7@gmail.com', '9818472789', '{\"634\":{\"cart_id\":\"634\",\"service_id\":\"1119\",\"session_id\":\"4e939169d154974e0003f343aa055b82\",\"quantity\":\"1\",\"amount\":\"2199\",\"offers\":\"20\"}}', '31-10-2022', '07:00PM-07:30PM', '', 'Please come at 7.30pm', '1829.2', 'Cash On Service', 'pending', '', 1, 100, '2022-10-31 16:05:30', 'Uday kumar, B7-408, SRS royal hills, Sector 87, Faridabad, Haryana - 121002', 1058, '4e939169d154974e0003f343aa055b82', 'pending', NULL, '9818472789', 1212, 'false', NULL, NULL, 'false', 'false', NULL, NULL, NULL, 'false', NULL, NULL, '70.00'),
(1101, 'Uday', 'udaygoel7@gmail.com', '9818472789', '{\"636\":{\"cart_id\":\"636\",\"service_id\":\"1108\",\"session_id\":\"4e939169d154974e0003f343aa055b82\",\"quantity\":\"1\",\"amount\":\"1999\",\"offers\":\"20\"}}', '31-10-2022', '07:00PM-07:30PM', '', 'Please come at 7.30 pm', '1663.2', 'Cash On Service', 'completed', '', 1, 100, '2022-10-31 16:07:25', 'Uday kumar, B7-408, SRS royal hills, Sector 87, Faridabad, Haryana - 121002', 1058, '4e939169d154974e0003f343aa055b82', 'Cash On Service Delivery', 100152, '9818472789', 1212, 'true', 500016, 'Pawan Kumar', 'false', 'false', NULL, NULL, NULL, 'false', NULL, NULL, '64.00'),
(1102, 'Raghav', 'sachdeva.raghav23@yahoo.com', '9560085328', '{\"671\":{\"cart_id\":\"671\",\"service_id\":\"1134\",\"session_id\":\"64fcc2c771e1ef0e8401c8fd5bb86f39\",\"quantity\":\"1\",\"amount\":\"1499\",\"offers\":\"20\"}}', '01-11-2022', '05:30PM-06:00PM', '', '', '1259.2', 'Cash On Service', 'pending', '', 1, 100, '2022-11-01 15:58:17', 'Rajeev , C-10/9, 3rd Floor, Model Town-3, Delhi, Delhi, Delhi - 110009', 1059, '64fcc2c771e1ef0e8401c8fd5bb86f39', 'Cash On Service Delivery', 100153, '9560085328', 1219, 'true', 500010, 'Shah alam', 'false', 'false', NULL, NULL, NULL, 'false', NULL, NULL, '60.00'),
(1103, 'Avinash Pathak', 'avin.pathak89@gmail.com', '8955584913', '{\"686\":{\"cart_id\":\"686\",\"service_id\":\"1113\",\"session_id\":\"74e7df3801475f8425b0575bf4786682\",\"quantity\":\"1\",\"amount\":\"1450\",\"offers\":\"20\"}}', '2 November ', '10:00AM-10:30AM', '', '', '1218', 'Cash On Service', 'pending', '', 1, 100, '2022-11-01 23:15:19', 'Avinash , Dallupura kirana chowk , Vasundhara enclave, Agrasen collage, Delhi, Delhi - 110096', 1061, '74e7df3801475f8425b0575bf4786682', 'Cash On Service Delivery', 100154, '8955584913', 1228, 'false', NULL, NULL, 'false', 'false', NULL, NULL, NULL, 'false', NULL, NULL, '58.00'),
(1104, 'Uday', 'udaygoel7@gmail.com', '9818472789', '{\"690\":{\"cart_id\":\"690\",\"service_id\":\"1108\",\"session_id\":\"00c847e16c92d9f7fd5cf32ca0045752\",\"quantity\":\"1\",\"amount\":\"1999\",\"offers\":\"20\"}}', '02-11-2022', '06:00PM-06:30PM', '', '', '1663.2', 'Cash On Service', 'pending', '', 1, 100, '2022-11-02 08:44:39', 'Uday kumar, B7-408, SRS royal hills, Sector 87, Faridabad, Haryana - 121002', 1058, '00c847e16c92d9f7fd5cf32ca0045752', 'Cash On Service Delivery', 100155, '9818472789', 1212, 'false', NULL, NULL, 'false', 'true', 'Urgent work', NULL, '2022-11-02 09:22:49', 'false', NULL, NULL, '64.00'),
(1105, 'Vijay Kumar ', 'vijaygupta19997@gmail.com', '9646420753', '{\"698\":{\"cart_id\":\"698\",\"service_id\":\"1069\",\"session_id\":\"6517d5a0f64ee90e6f39ea72f59517da\",\"quantity\":\"1\",\"amount\":\"1599\",\"offers\":\"20\"}}', '02-11-2022', '12:30PM-01:00PM', '', '', '1343.2', 'Cash On Service', 'pending', '', 1, 100, '2022-11-02 10:24:41', 'Vijay, 2613, Sector 46 , Gurgaon , Haryana - 122001', 1047, '6517d5a0f64ee90e6f39ea72f59517da', 'Cash On Service Delivery', 100157, '9646420753', 1197, 'false', NULL, NULL, 'false', 'false', NULL, NULL, NULL, 'false', NULL, NULL, '64.00'),
(1106, 'SACHIN S', 'sachin1246@gmail.com', '9599904978', '{\"701\":{\"cart_id\":\"701\",\"service_id\":\"1069\",\"session_id\":\"2a7c6268a5404254bf64c9afbc791dac\",\"quantity\":\"1\",\"amount\":\"1599\",\"offers\":\"20\"}}', '05-11-2022', '07:00PM-07:30PM', '', '', '1343.2', 'Cash On Service', 'accepted', '', 1, 100, '2022-11-02 12:40:19', 'SACHIN S, A4-902, Uniworld Gardens 2, Sector 47, Sector 47, Gurgaon, Haryana - 122018', 1062, '2a7c6268a5404254bf64c9afbc791dac', 'Cash On Service Delivery', 100158, '9599904978', 1232, 'true', 500019, 'Jitendra Kumar', 'false', 'true', 'Urgent work', NULL, '2022-11-07 14:18:09', 'true', '08-11-2022', '03:00PM-03:30PM', '64.00'),
(1107, 'Sanjay verma', 'sanjay.verma64@yahoo.com', '9971834992', '{\"729\":{\"cart_id\":\"729\",\"service_id\":\"1113\",\"session_id\":\"08c3067cd3d5a8ea2deaefaff86f9c80\",\"quantity\":\"1\",\"amount\":\"1450\",\"offers\":\"20\"}}', '03-11-2022', '03:30PM-04:00PM', '', '', '1218', 'Cash On Service', 'pending', '', 1, 100, '2022-11-03 09:23:13', 'Sanjay verma, Motherdairy rajendra nagar, Rajendra nagar, Major mohit sharma metro station, Sahibabad, Uttar Pradesh - 201005', 1063, '08c3067cd3d5a8ea2deaefaff86f9c80', 'Cash On Service Delivery', 100162, '9971834992', 1236, 'false', NULL, NULL, 'false', 'false', NULL, NULL, NULL, 'false', NULL, NULL, '58.00'),
(1108, 'Rajat Munjal', 'rajatmunjal@rediffmail.com', '8859988775', '{\"746\":{\"cart_id\":\"746\",\"service_id\":\"1069\",\"session_id\":\"7ebb8cf02b6c4add53794a150e0a74e8\",\"quantity\":\"1\",\"amount\":\"1599\",\"offers\":\"20\"}}', '04-11-2022', '08:30AM-09:00AM', '', 'Need smart male masseur ', '1343.2', 'Cash On Service', 'completed', '', 1, 100, '2022-11-03 23:17:13', 'Rajat Munjal, T6 506 Pivotal Deevan, Sector 84, Gurugram, Haryana - 122004', 1064, '7ebb8cf02b6c4add53794a150e0a74e8', 'Cash On Service Delivery', 100166, '8859988775', 1239, 'true', 500017, 'Saheb Kumar Matya', 'false', 'false', NULL, NULL, NULL, 'false', NULL, NULL, '64.00'),
(1109, 'Sumit Chakravarty', 'sumitchak86@gmail.com', '9717821402', '{\"774\":{\"cart_id\":\"774\",\"service_id\":\"1107\",\"session_id\":\"72a47c82cb2a1e0db6cf468778c31b00\",\"quantity\":\"1\",\"amount\":\"1499\",\"offers\":\"20\"}}', '04-11-2022', '02:30PM-03:00PM', '', '', '1259.2', 'Cash On Service', 'accepted', '', 1, 100, '2022-11-04 12:18:33', 'Sumit Chakravarty, A3-802, TULIP Orange Sector 70 Gurugram, Sector 70 , Gurugram, Haryana, India, Haryana - 122018', 1065, '72a47c82cb2a1e0db6cf468778c31b00', 'Cash On Service Delivery', 100168, '9717821402', 1241, 'true', 500017, 'Saheb Kumar Matya', 'false', 'true', 'Urgent work', NULL, '2022-11-04 12:56:44', 'false', NULL, NULL, '60.00'),
(1110, 'Uday', 'udaygoel7@gmail.com', '9818472789', '{\"785\":{\"cart_id\":\"785\",\"service_id\":\"1108\",\"session_id\":\"00c847e16c92d9f7fd5cf32ca0045752\",\"quantity\":\"1\",\"amount\":\"1999\",\"offers\":\"20\"}}', '04-11-2022', NULL, '', '', '1663.2', 'Cash On Service', 'pending', '', 1, 100, '2022-11-04 17:45:54', 'Uday kumar, B7-408, SRS royal hills, Sector 87, Faridabad, Haryana - 121002', 1058, '00c847e16c92d9f7fd5cf32ca0045752', 'pending', NULL, '9818472789', 1212, 'false', NULL, NULL, 'false', 'false', NULL, NULL, NULL, 'false', NULL, NULL, '64.00'),
(1111, 'Uday', 'udaygoel7@gmail.com', '9818472789', '{\"785\":{\"cart_id\":\"785\",\"service_id\":\"1108\",\"session_id\":\"00c847e16c92d9f7fd5cf32ca0045752\",\"quantity\":\"1\",\"amount\":\"1999\",\"offers\":\"20\"}}', '04-11-2022', NULL, '', '', '1663.2', 'Cash On Service', 'completed', '', 1, 100, '2022-11-04 18:00:01', 'Uday kumar, B7-408, SRS royal hills, Sector 87, Faridabad, Haryana - 121002', 1058, '00c847e16c92d9f7fd5cf32ca0045752', 'Cash On Service Delivery', 100171, '9818472789', 1212, 'true', 500019, 'Jitendra Kumar', 'false', 'false', NULL, NULL, NULL, 'false', NULL, NULL, '64.00'),
(1112, 'Nikhil kumar', 'ns51307@gmail.com', '9973850260', '{\"786\":{\"cart_id\":\"786\",\"service_id\":\"1119\",\"session_id\":\"54da8471640d4ef0a923c90a5fb672ac\",\"quantity\":\"1\",\"amount\":\"2199\",\"offers\":\"20\"}}', '07-11-2022', '01:30PM-02:00PM', '', '', '1829.2', 'Cash On Service', 'pending', '', 1, 100, '2022-11-04 19:03:46', 'Nikhil kumar, Vill+post-mathura, Mathura high school, Kg internatinol school, Hajipur, Bihar - 844503', 1067, '54da8471640d4ef0a923c90a5fb672ac', 'pending', NULL, '9973850260', 1244, 'false', NULL, NULL, 'false', 'false', NULL, NULL, NULL, 'false', NULL, NULL, '70.00'),
(1113, 'Sunny Singh', 'sunnysingh250490@gmail.com', '9454265020', '{\"800\":{\"cart_id\":\"800\",\"service_id\":\"1119\",\"session_id\":\"7c0a83bb85bac4e6082256f20b0d501c\",\"quantity\":\"1\",\"amount\":\"2199\",\"offers\":\"20\"}}', '05-11-2022', '01:30PM-02:00PM', '', 'Need female therapist ', '1829.2', 'Cash On Service', 'pending', '', 1, 100, '2022-11-05 00:37:14', 'Sunny Singh, Elite Homz , Sector 77, Noida, Uttar Pradesh - 201301', 1069, '7c0a83bb85bac4e6082256f20b0d501c', 'Cash On Service Delivery', 100173, '9454265020', 1246, 'false', NULL, NULL, 'false', 'true', 'Urgent work', NULL, '2022-11-05 01:08:35', 'false', NULL, NULL, '70.00'),
(1114, 'Gautam Malik', 'er.gautammalik@gmail.com', '9625086611', '{\"815\":{\"cart_id\":\"815\",\"service_id\":\"1113\",\"session_id\":\"06934bf328f527ca4e49eb6a9089e637\",\"quantity\":\"1\",\"amount\":\"1450\",\"offers\":\"20\"}}', '05-11-2022', '12:30PM-01:00PM', '', '', '1218', 'Cash On Service', 'pending', '', 1, 100, '2022-11-05 10:19:19', 'Gautam Malik, H.no. 229,3rd floor  Hari Nagar , Ashram , Bhumia mata mandir gali, New Delhi , Delhi - 110014', 1070, '06934bf328f527ca4e49eb6a9089e637', 'Cash On Service Delivery', 100174, '9625086611', 1249, 'false', NULL, NULL, 'false', 'false', NULL, NULL, NULL, 'false', NULL, NULL, '58.00'),
(1115, 'Gaurav Tiwari', 'vimal.chints@gmail.com', '9561478019', '{\"827\":{\"cart_id\":\"827\",\"service_id\":\"1107\",\"session_id\":\"11d37645dc2ba48a6e6e8e6576f23d61\",\"quantity\":\"1\",\"amount\":\"1499\",\"offers\":\"20\"}}', '05-11-2022', '02:30PM-03:00PM', '', '', '1259.2', 'Cash On Service', 'pending', '', 1, 100, '2022-11-05 12:01:50', 'Gaurav, D110, First Floor , Sector 27, noida, Noida, Uttar Pradesh - 201301', 1071, '11d37645dc2ba48a6e6e8e6576f23d61', 'Cash On Service Delivery', 100176, '9561478019', 1208, 'false', NULL, NULL, 'false', 'false', NULL, NULL, NULL, 'false', NULL, NULL, '60.00'),
(1116, 'Nipam', 'nipamsharma23011990@gmail.com', '8447675679', '{\"841\":{\"cart_id\":\"841\",\"service_id\":\"1069\",\"session_id\":\"9f84a79e821929a7a41b45e72d8ffc1a\",\"quantity\":\"1\",\"amount\":\"1599\",\"offers\":\"20\"}}', '05-11-2022', '06:30PM-07:00PM', '', 'You can come to before 6 30 also ', '1343.2', 'Cash On Service', 'pending', '', 1, 100, '2022-11-05 16:09:02', 'Nipam , D6 uppal southend , Sector 49 , Near sai mandir , Gurgaon , Haryana - 122018', 1036, '9f84a79e821929a7a41b45e72d8ffc1a', 'Cash On Service Delivery', 100177, '8447675679', 1158, 'false', NULL, NULL, 'false', 'false', NULL, NULL, NULL, 'false', NULL, NULL, '64.00'),
(1117, 'Vijay Kumar ', 'vijaygupta19997@gmail.com', '9646420753', '{\"876\":{\"cart_id\":\"876\",\"service_id\":\"1069\",\"session_id\":\"c76d0690b04533c63985226a3c38b893\",\"quantity\":\"1\",\"amount\":\"1599\",\"offers\":\"20\"}}', '11/06/2022', '02:30PM-03:00PM', '', '', '1343.2', 'Cash On Service', 'completed', '', 1, 100, '2022-11-06 13:30:28', 'Vijay, 2613, Sector 46 , Gurgaon , Haryana - 122001', 1047, 'c76d0690b04533c63985226a3c38b893', 'Cash On Service Delivery', 100178, '9646420753', 1197, 'true', 500016, 'Pawan Kumar', 'false', 'false', NULL, NULL, NULL, 'false', NULL, NULL, '64.00'),
(1118, 'Uday', 'udaygoel7@gmail.com', '9818472789', '{\"881\":{\"cart_id\":\"881\",\"service_id\":\"1108\",\"session_id\":\"00c847e16c92d9f7fd5cf32ca0045752\",\"quantity\":\"1\",\"amount\":\"1999\",\"offers\":\"20\"}}', '11/06/2022', '06:00PM-06:30PM', '', '', '1663.2', 'Cash On Service', 'accepted', '', 1, 100, '2022-11-06 15:44:43', 'Uday kumar, B7-408, SRS royal hills, Sector 87, Faridabad, Haryana - 121002', 1058, '00c847e16c92d9f7fd5cf32ca0045752', 'Cash On Service Delivery', 100179, '9818472789', 1212, 'true', 500019, 'Jitendra Kumar', 'false', 'true', 'Urgent work', NULL, '2022-11-06 16:18:21', 'false', NULL, NULL, '64.00'),
(1119, 'Rakesh Kumar', 'rakeshkumar@gmail.com', '9871493123', '{\"945\":{\"cart_id\":\"945\",\"service_id\":\"1113\",\"session_id\":\"1b49bba18a443e0d264c3032ad12c2cd\",\"quantity\":\"1\",\"amount\":\"1450\",\"offers\":\"20\"}}', '11/08/2022', '02:00PM-02:30PM', '', 'therapist should be nit and clean', '1218', 'Cash On Service', 'pending', '', 1, 100, '2022-11-08 11:49:00', 'Rakesh kumar, B3 A/326, janakpuri, Godiya maath mandir, NEW DELHI, Delhi - 110046', 1075, '1b49bba18a443e0d264c3032ad12c2cd', 'Cash On Service Delivery', 100180, '9871493123', 1266, 'false', NULL, NULL, 'false', 'false', NULL, NULL, NULL, 'false', NULL, NULL, '58.00'),
(1120, 'Uday', 'udaygoel7@gmail.com', '9818472789', '{\"956\":{\"cart_id\":\"956\",\"service_id\":\"1108\",\"session_id\":\"6765e5cbe915d14dfb1b18861a0dccb9\",\"quantity\":\"1\",\"amount\":\"1999\",\"offers\":\"20\"}}', '11/08/2022', '07:00PM-07:30PM', '', '', '1663.2', 'Cash On Service', 'pending', '', 1, 100, '2022-11-08 14:46:16', 'Uday kumar, B7-408, SRS royal hills, Sector 87, Faridabad, Haryana - 121002', 1058, '6765e5cbe915d14dfb1b18861a0dccb9', 'Cash On Service Delivery', 100181, '9818472789', 1212, 'false', NULL, NULL, 'false', 'false', NULL, NULL, NULL, 'false', NULL, NULL, '64.00'),
(1121, 'Akki', 'akin4@rediffmail.com', '9065655500', '{\"962\":{\"cart_id\":\"962\",\"service_id\":\"1070\",\"session_id\":\"275a05ad6b0975832df728496aaba71e\",\"quantity\":\"1\",\"amount\":\"2299\",\"offers\":\"25\"}}', '11/08/2022', '05:30PM-06:00PM', '', '', '1793.25', 'Cash On Service', 'pending', '', 1, 100, '2022-11-08 17:37:50', 'Akki, 6233 ats dolce, Zeta-01, Greater Noida, Gautam Buddh Nagar, Uttar Pradesh - 201306', 1076, '275a05ad6b0975832df728496aaba71e', 'Cash On Service Delivery', 100182, '9065655500', 1269, 'false', NULL, NULL, 'false', 'false', NULL, NULL, NULL, 'false', NULL, NULL, '69.00'),
(1122, 'Vijay Gangwar ', 'qute.vijay@gmail.com', '9639990952', '{\"792\":{\"cart_id\":\"792\",\"service_id\":\"1119\",\"session_id\":\"7c218960cfb7c260901c13c958e36a24\",\"quantity\":\"1\",\"amount\":\"2199\",\"offers\":\"20\"}}', '11/08/2022', '07:00PM-07:30PM', '', '', '1829.2', 'Cash On Service', 'pending', '', 1, 100, '2022-11-08 20:14:19', '85f, Pocket 1 , Mayur vihar phase 1 , Sri Ram mandir , Delhi, Delhi - 110009', 1077, '7c218960cfb7c260901c13c958e36a24', 'Cash On Service Delivery', 100183, '9639990952', 1270, 'false', NULL, NULL, 'false', 'false', NULL, NULL, NULL, 'false', NULL, NULL, '70.00'),
(1123, 'Sunil ', 'sunilgitm@gmail.com', '9958805622', '{\"982\":{\"cart_id\":\"982\",\"service_id\":\"1124\",\"session_id\":\"ab409811fad6be025ead712947611c03\",\"quantity\":\"1\",\"amount\":\"1299\",\"offers\":\"20\"}}', '11/09/2022', '09:30AM-10.00AM', '', '', '1091.2', 'Cash On Service', 'pending', '', 1, 100, '2022-11-09 11:21:03', 'sunil, noida sector 5, noida, durga manidr, noida, Uttar Pradesh - 201301', 1003, 'ab409811fad6be025ead712947611c03', 'pending', NULL, '9958805622', 1023, 'false', NULL, NULL, 'false', 'false', NULL, NULL, NULL, 'false', NULL, NULL, '52.00'),
(1124, 'Mukul ', 'manthanmukul@gmail.com', '9910072395', '{\"928\":{\"cart_id\":\"928\",\"service_id\":\"1069\",\"session_id\":\"811fc958252fb45b44d3b0d3b9c143d5\",\"quantity\":\"1\",\"amount\":\"1599\",\"offers\":\"20\"}}', '11/09/2022', '06:30PM-07:00PM', '', '', '1343.2', 'Cash On Service', 'pending', '', 1, 100, '2022-11-09 11:50:58', 'Mukul , Hotel Rewari Holidays , Rewari , Gurugram, Haryana, India, Haryana - 123401', 1079, '811fc958252fb45b44d3b0d3b9c143d5', 'Cash On Service Delivery', 100186, '9910072395', 1273, 'false', NULL, NULL, 'true', 'false', NULL, 'No service in rewari', '2022-11-09 15:19:53', 'false', NULL, NULL, '64.00'),
(1125, 'Sunil ', 'sunilgitm@gmail.com', '9958805622', '{\"988\":{\"cart_id\":\"988\",\"service_id\":\"1122\",\"session_id\":\"ab409811fad6be025ead712947611c03\",\"quantity\":\"1\",\"amount\":\"500\",\"offers\":\"25\"}}', '11/09/2022', '12:30PM-01:00PM', '', '', '394', 'Cash On Service', 'pending', '', 1, 100, '2022-11-09 12:39:08', 'sunil, noida sector 5, noida, durga manidr, noida, Uttar Pradesh - 201301', 1003, 'ab409811fad6be025ead712947611c03', 'pending', NULL, '9958805622', 1023, 'false', NULL, NULL, 'false', 'false', NULL, NULL, NULL, 'false', NULL, NULL, '19.00'),
(1126, 'Sunil ', 'sunilgitm@gmail.com', '9958805622', '{\"988\":{\"cart_id\":\"988\",\"service_id\":\"1122\",\"session_id\":\"ab409811fad6be025ead712947611c03\",\"quantity\":\"1\",\"amount\":\"500\",\"offers\":\"25\"}}', '11/09/2022', '12:00PM-12:30PM', '', '', '394', 'Cash On Service', 'pending', '', 1, 100, '2022-11-09 12:39:50', 'sunil, noida sector 5, noida, durga manidr, noida, Uttar Pradesh - 201301', 1003, 'ab409811fad6be025ead712947611c03', 'Cash On Service Delivery', 100190, '9958805622', 1023, 'false', NULL, NULL, 'true', 'false', NULL, 'testing perpose', '2022-11-09 15:18:58', 'false', NULL, NULL, '19.00'),
(1127, 'Sunil ', 'sunilgitm@gmail.com', '9958805622', '{\"993\":{\"cart_id\":\"993\",\"service_id\":\"1124\",\"session_id\":\"ab409811fad6be025ead712947611c03\",\"quantity\":\"1\",\"amount\":\"1299\",\"offers\":\"20\"}}', '11/09/2022', '02:00PM-02:30PM', '', '', '1091.2', 'Cash On Service', 'pending', '', 1, 100, '2022-11-09 15:21:26', 'sunil, noida sector 5, noida, durga manidr, noida, Uttar Pradesh - 201301', 1003, 'ab409811fad6be025ead712947611c03', 'pending', NULL, '9958805622', 1023, 'false', NULL, NULL, 'false', 'false', NULL, NULL, NULL, 'false', NULL, NULL, '52.00'),
(1128, 'Sankalp Sharma', 'sankalp23061996@gmail.com', '8630283629', '{\"1012\":{\"cart_id\":\"1012\",\"service_id\":\"1113\",\"session_id\":\"75708c10411951abd39b8176195f9cd8\",\"quantity\":\"1\",\"amount\":\"1450\",\"offers\":\"20\"}}', '10-11-2022', '12:30PM-01:00PM', '', '', '1218', 'Cash On Service', 'completed', '', 1, 100, '2022-11-10 10:38:49', 'Sankalp Sharma , A320 3rd floor room no 307 , A block south city 1 in front of gate no 2 , Gurugram, Haryana - 122001', 1080, '75708c10411951abd39b8176195f9cd8', 'Cash On Service Delivery', 100192, '8630283629', 1278, 'true', 500017, 'Saheb Kumar Matya', 'false', 'false', NULL, NULL, NULL, 'false', NULL, NULL, '58.00'),
(1129, 'Sankalp Sharma', 'sankalp23061996@gmail.com', '8630283629', '{\"1021\":{\"cart_id\":\"1021\",\"service_id\":\"1113\",\"session_id\":\"75708c10411951abd39b8176195f9cd8\",\"quantity\":\"1\",\"amount\":\"1450\",\"offers\":\"20\"}}', '10-11-2022', '02:30PM-03:00PM', '', '', '1218', 'Cash On Service', 'pending', '', 1, 100, '2022-11-10 12:10:00', 'Sankalp Sharma , A320 3rd floor room no 307 , A block south city 1 in front of gate no 2 , Gurugram, Haryana - 122001', 1080, '75708c10411951abd39b8176195f9cd8', 'Cash On Service Delivery', 100193, '8630283629', 1278, 'false', NULL, NULL, 'false', 'true', 'Order by Mistake', NULL, '2022-11-10 12:12:54', 'false', NULL, NULL, '58.00'),
(1130, 'Aarav', 'aaravkapoor501@gmail.com', '9667429750', '{\"1052\":{\"cart_id\":\"1052\",\"service_id\":\"1113\",\"session_id\":\"e71ea7213fe4c0a12cd48a1227b83e13\",\"quantity\":\"1\",\"amount\":\"1450\",\"offers\":\"20\"}}', '11-11-2022', NULL, '', 'Send well groomed and hygenic therapist', '1218', 'Cash On Service', 'accepted', '', 1, 100, '2022-11-11 09:00:10', 'Aarav, 1196/13  near ananda dairy, Govindpuri Gali no 13 , NEW DELHI, Delhi - 110019', 1082, 'e71ea7213fe4c0a12cd48a1227b83e13', 'Cash On Service Delivery', 100194, '9667429750', 1288, 'true', 500017, 'Saheb Kumar Matya', 'false', 'true', 'Order by Mistake', NULL, '2022-11-11 10:04:33', 'false', NULL, NULL, '58.00'),
(1131, 'Priya', 'priya@yahoo.in', '8860455796', '{\"1060\":{\"cart_id\":\"1060\",\"service_id\":\"1118\",\"session_id\":\"4d2c4a3af6af3e94d538c7df4eff6364\",\"quantity\":\"1\",\"amount\":\"499\",\"offers\":\"20\"}}', '11-11-2022', '02:30PM-03:00PM', '', '', '419.2', 'Cash On Service', 'completed', '', 1, 100, '2022-11-11 12:39:01', 'Priya, A25/20, DLF phase 1, Qutab plaza, Gurgaon, Haryana - 122002', 1083, '4d2c4a3af6af3e94d538c7df4eff6364', 'Cash On Service Delivery', 100195, '8860455796', 1289, 'true', 500003, 'Khushboo', 'false', 'false', NULL, NULL, NULL, 'false', NULL, NULL, '20.00'),
(1132, 'Kapil', 'Kaps1983@hotmail.com', '9599318004', '{\"710\":{\"cart_id\":\"710\",\"service_id\":\"1108\",\"session_id\":\"1d20566ba3c4d4f812f3213d416df7e9\",\"quantity\":\"1\",\"amount\":\"1999\",\"offers\":\"20\"}}', '12-11-2022', '11:30AM-12:00PM', '', '', '1663.2', 'Cash On Service', 'completed', '', 1, 100, '2022-11-12 09:05:23', 'Kapil, Sun view apartments, Dwarka sector 11, Pocket 4 Dwarka sector 11, NEW DELHI, Delhi - 110075', 1084, 'cd306f6aa93148505938e1f24e46e702', 'Cash On Service Delivery', 100196, '9599318004', 1234, 'true', 500002, 'Anil Kumar', 'false', 'false', NULL, NULL, NULL, 'false', NULL, NULL, '64.00'),
(1133, 'dharmendra', 'dkumar.expert@gmail.com', '8802634692', '{\"1108\":{\"cart_id\":\"1108\",\"service_id\":\"1181\",\"session_id\":\"fac28dd73a05b55c3cce24aef16c8bfc\",\"quantity\":\"1\",\"amount\":\"149\",\"offers\":\"40\"}}', '19-11-2022', '09:30AM-10.00AM', '', 'demo', '89.4', 'Cash On Service', 'pending', '', 1, 100, '2022-11-12 19:39:54', 'Dharmendra, demo, delhi, delhi, Delhi - 110096', 1034, 'fac28dd73a05b55c3cce24aef16c8bfc', 'pending', NULL, '8802634692', 1156, 'false', NULL, NULL, 'false', 'false', NULL, NULL, NULL, 'false', NULL, NULL, '0.00'),
(1134, 'Prashant Sharma ', 'psharma8949@gmail.com', '9376608949', '{\"1117\":{\"cart_id\":\"1117\",\"service_id\":\"1069\",\"session_id\":\"2a59b2055ed63cd436d23f1d9b620848\",\"quantity\":\"1\",\"amount\":\"1599\",\"offers\":\"20\"}}', '13-11-2022', '12:30PM-01:00PM', '', '', '1343.2', 'Cash On Service', 'pending', '', 1, 100, '2022-11-13 02:19:52', 'Prashant Sharma , K-1204, Microtech Greenberg , Sector 86, opposite sant Xavier school , Opposite sant Xavier school , Gurugram, Haryana - 122004', 1085, '2a59b2055ed63cd436d23f1d9b620848', 'Cash On Service Delivery', 100198, '9376608949', 1298, 'false', NULL, NULL, 'false', 'false', NULL, NULL, NULL, 'false', NULL, NULL, '64.00'),
(1135, 'Uday', 'udaygoel7@gmail.com', '9818472789', '{\"1097\":{\"cart_id\":\"1097\",\"service_id\":\"1114\",\"session_id\":\"6765e5cbe915d14dfb1b18861a0dccb9\",\"quantity\":\"1\",\"amount\":\"1950\",\"offers\":\"20\"}}', '13-11-2022', '06:30PM-07:00PM', '', '', '1622', 'Cash On Service', 'completed', '', 1, 100, '2022-11-13 16:26:49', 'Uday kumar, B7-408, SRS royal hills, Sector 87, Faridabad, Haryana - 121002', 1058, '6765e5cbe915d14dfb1b18861a0dccb9', 'Cash On Service Delivery', 100199, '9818472789', 1212, 'true', 500016, '', 'false', 'false', NULL, NULL, NULL, 'false', NULL, NULL, '62.00'),
(1136, 'Balram singh', 'shivangischn@gmail.com', '8953408373', '{\"1170\":{\"cart_id\":\"1170\",\"service_id\":\"1075\",\"session_id\":\"73f0ba2a09f72b3600311b1ff02a0333\",\"quantity\":\"1\",\"amount\":\"2199\",\"offers\":\"20\"}}', '14-11-2022', NULL, '', 'Female staff only', '1829.2', 'Cash On Service', 'completed', '', 1, 100, '2022-11-14 09:34:41', 'Balram singh, S5 1101 eldeco amantran, sec 119, FNG expressway , Noida, Uttar Pradesh - 201305', 1088, '73f0ba2a09f72b3600311b1ff02a0333', 'Cash On Service Delivery', 100200, '8953408373', 1312, 'true', 500009, 'Huma naz', 'false', 'false', NULL, NULL, NULL, 'false', NULL, NULL, '70.00'),
(1137, 'AJ', 'devilsheel@gmail.com', '8882549108', '[{\"cart_id\":\"1176\",\"service_id\":\"1074\",\"session_id\":\"2caa5a6ef8b0fc5a291a8d825843996b\",\"quantity\":\"1\",\"amount\":\"899\",\"offers\":\"50\"},{\"cart_id\":\"1177\",\"service_id\":\"1121\",\"session_id\":\"2caa5a6ef8b0fc5a291a8d825843996b\",\"quantity\":\"1\",\"amount\":\"700\",\"offers\":\"20\"}]', '14-11-2022', '01:30PM-02:00PM', '', '', '1059.5', 'Cash On Service', 'pending', '', 1, 100, '2022-11-14 11:29:31', 'Abhijeet Golder , U77/14 , Dlf phase 3 , Gurugram, Delhi - 122022', 1089, '2caa5a6ef8b0fc5a291a8d825843996b', 'Cash On Service Delivery', 100201, '8882549108', 1313, 'false', NULL, NULL, 'true', 'false', NULL, 'Sorry We Not Provide female to male service , our service is female to female or male to male service , in Delhi NCR', '2022-11-14 12:04:26', 'false', NULL, NULL, '50.00'),
(1138, 'dharmendra', 'dkumar.expert@gmail.com', '8802634692', '{\"1214\":{\"cart_id\":\"1214\",\"service_id\":\"1033\",\"session_id\":\"d921afe800d6da8983eb590aa88346a8\",\"quantity\":\"1\",\"amount\":\"1599\",\"offers\":\"20\"}}', '15-11-2022', NULL, '', '', '1343.2', 'Cash On Service', 'pending', '', 1, 100, '2022-11-14 23:40:14', 'Dharmendra, demo, delhi, delhi, Delhi - 110096', 1034, 'd921afe800d6da8983eb590aa88346a8', 'pending', NULL, '8802634692', 1156, 'false', NULL, NULL, 'false', 'false', NULL, NULL, NULL, 'false', NULL, NULL, '64.00'),
(1139, 'Nitin', 'nitin.goyal0006@gmail.com', '9582080006', '{\"847\":{\"cart_id\":\"847\",\"service_id\":\"1069\",\"session_id\":\"09418ac10f34fe30069891c8dd9bfd1f\",\"quantity\":\"1\",\"amount\":\"1599\",\"offers\":\"20\"}}', '15-11-2022', '10:00AM-10:30AM', '', '', '1343.2', 'Cash On Service', 'pending', '', 1, 100, '2022-11-15 07:38:48', 'Nitin Goyal , 442,3rd floor, room number 3, sector 45 , Sector 45, Near St angle sr sec school , Gurgaon, Haryana - 122003', 1090, '09418ac10f34fe30069891c8dd9bfd1f', 'Cash On Service Delivery', 100205, '9582080006', 1251, 'false', NULL, NULL, 'false', 'true', 'Urgent work', NULL, '2022-11-15 08:31:11', 'false', NULL, NULL, '64.00'),
(1140, 'Prashant Sharma ', 'psharma8949@gmail.com', '9376608949', '{\"1228\":{\"cart_id\":\"1228\",\"service_id\":\"1069\",\"session_id\":\"44d32556861c3439f6d13a70d7969253\",\"quantity\":\"1\",\"amount\":\"1599\",\"offers\":\"20\"}}', '20-11-2022', '11:00AM-11:30AM', '', '', '1343.2', 'Cash On Service', 'completed', '', 1, 100, '2022-11-15 11:09:19', 'Prashant Sharma , K-1204, Microtech Greenberg , Sector 86, opposite sant Xavier school , Opposite sant Xavier school , Gurugram, Haryana - 122004', 1085, '44d32556861c3439f6d13a70d7969253', 'Cash On Service Delivery', 100206, '9376608949', 1298, 'true', 500016, 'Pawan Kumar', 'false', 'false', NULL, NULL, NULL, 'true', '20-11-2022', '12:30PM-01:00PM', '64.00'),
(1141, 'prathiba kumari', 'prathiba@gmail.com', '8377981841', '{\"1268\":{\"cart_id\":\"1268\",\"service_id\":\"1075\",\"session_id\":\"dd1a8a1f3f175794c46d1b62acf063ec\",\"quantity\":\"1\",\"amount\":\"2199\",\"offers\":\"20\"}}', '19-11-2022', '05:30PM-06:00PM', '', '', '1829.2', 'Cash On Service', 'completed', '', 1, 100, '2022-11-16 12:21:17', 'Prathiba kumari, gali no 7 road no.4, opposite iconic hotel, mahipal pur, opposite iconic hotel, NEW DELHI, Delhi - 110037', 1093, 'dd1a8a1f3f175794c46d1b62acf063ec', 'Cash On Service Delivery', 100207, '8377981841', 1331, 'true', 500009, 'Huma naz', 'false', 'false', NULL, NULL, NULL, 'false', NULL, NULL, '70.00'),
(1142, 'Mike', 'mickeyfedulov@gmail.com', '8130524500', '{\"1273\":{\"cart_id\":\"1273\",\"service_id\":\"1134\",\"session_id\":\"a404abf37e6b37595e18ef2bd7422cf3\",\"quantity\":\"1\",\"amount\":\"1499\",\"offers\":\"20\"}}', '16-11-2022', '06:30PM-07:00PM', '', 'Mantioned that its 60 min massage, but timeslot only for 30 minutes', '1259.2', 'Cash On Service', 'completed', '', 1, 100, '2022-11-16 13:44:10', 'Mike, Saket M-15, Saket M-15, 1st floor, NEW DELHI, Delhi - 110017', 1094, 'a404abf37e6b37595e18ef2bd7422cf3', 'Cash On Service Delivery', 100208, '8130524500', 1332, 'true', 500019, 'Jitendra Kumar', 'false', 'false', NULL, NULL, NULL, 'false', NULL, NULL, '60.00'),
(1143, 'GD', 'gyan.darshan1994@gmail.com', '9658334646', '{\"1282\":{\"cart_id\":\"1282\",\"service_id\":\"1113\",\"session_id\":\"4801e1d96a9178096bd457e028efa409\",\"quantity\":\"1\",\"amount\":\"1450\",\"offers\":\"20\"}}', '16-11-2022', '07:00PM-07:30PM', '', '', '1218', 'Cash On Service', 'pending', '', 1, 100, '2022-11-16 16:18:05', 'GD, Marriott 1805, urbtech Xavier, Noida 168, Noida 168, Noida, Uttar Pradesh - 201306', 1096, '4801e1d96a9178096bd457e028efa409', 'Cash On Service Delivery', 100209, '9658334646', 1333, 'false', NULL, NULL, 'false', 'false', NULL, NULL, NULL, 'false', NULL, NULL, '58.00'),
(1144, 'Abhinav ', 'abhiarora3011@gmail.com', '8860092206', '{\"1330\":{\"cart_id\":\"1330\",\"service_id\":\"1069\",\"session_id\":\"1d225cf8a05b4dc78c8e162bc813ef85\",\"quantity\":\"1\",\"amount\":\"1599\",\"offers\":\"20\"}}', '17-11-2022', '06:30PM-07:00PM', '', '', '1343.2', 'Cash On Service', 'completed', '', 1, 100, '2022-11-17 16:58:31', 'Abhinav , 80/61B second floor , Malviya Nagar , Opposite L block Gurudwara , Delhi, Delhi - 110017', 1097, '1d225cf8a05b4dc78c8e162bc813ef85', 'Cash On Service Delivery', 100210, '8860092206', 1345, 'true', 500017, 'Saheb Kumar Matya', 'false', 'false', NULL, NULL, NULL, 'false', NULL, NULL, '64.00'),
(1145, 'Richard ', 'pandav.richard@gmail.com', '9711773200', '{\"1336\":{\"cart_id\":\"1336\",\"service_id\":\"1119\",\"session_id\":\"26ef51515b27dd1ba75ae9cc842fe258\",\"quantity\":\"1\",\"amount\":\"2199\",\"offers\":\"20\"}}', '18-11-2022', '04:30PM-05:00PM', '', '', '1829.2', 'Cash On Service', 'completed', '', 1, 100, '2022-11-17 18:25:31', 'Richard Pandav, C-47 , Eros Lakewood city, surajkund , Opp ibiza tower, Faridabad, Haryana - 121009', 1098, '26ef51515b27dd1ba75ae9cc842fe258', 'Cash On Service Delivery', 100211, '9711773200', 1346, 'true', 500016, 'Pawan Kumar', 'false', 'false', NULL, NULL, NULL, 'false', NULL, NULL, '70.00'),
(1146, 'Arun', 'arunmysuru@gmail.com', '8527345809', '{\"1355\":{\"cart_id\":\"1355\",\"service_id\":\"1106\",\"session_id\":\"712ed8cbe428a503c1b6270509bf6c82\",\"quantity\":\"1\",\"amount\":\"2100\",\"offers\":\"20\"}}', '19-11-2022', NULL, '', '', '1747', 'Online', 'completed', '', 1, 100, '2022-11-18 11:50:25', 'Arun, House Number 21, Block-3, Type-5, CPWD Lodi Road Complex, NEW DELHI, Delhi - 110003', 1099, '712ed8cbe428a503c1b6270509bf6c82', 'Payment Capture successfully', 100212, '8527345809', 1352, 'true', 500002, 'Anil Kumar', 'false', 'false', NULL, NULL, NULL, 'false', NULL, NULL, '67.00'),
(1147, 'Amit', 'poojaarchana100@gmail.com', '9354329209', '{\"1338\":{\"cart_id\":\"1338\",\"service_id\":\"1069\",\"session_id\":\"e8a1d9f88d61d5cb49f712c38c411725\",\"quantity\":\"1\",\"amount\":\"1599\",\"offers\":\"20\"}}', '18-11-2022', '04:30PM-05:00PM', '', '', '1343.2', 'Cash On Service', 'completed', '', 1, 100, '2022-11-18 14:51:51', 'Amit, B208,amrapali leisure valley greater noida, Greater noida, Noida, Uttar Pradesh - 201310', 1100, '879f6cf71a05e4dbe3bad78f1e6fb62e', 'Cash On Service Delivery', 100213, '9354329209', 1347, 'true', 500020, 'Mohd Mohsin Siddiqui', 'false', 'false', NULL, NULL, NULL, 'false', NULL, NULL, '64.00'),
(1148, 'Manu', 'dheeraj1992chandran@gmail.com', '8860650135', '{\"1370\":{\"cart_id\":\"1370\",\"service_id\":\"1069\",\"session_id\":\"e881854aed3fec87076ccbb5850998f0\",\"quantity\":\"1\",\"amount\":\"1599\",\"offers\":\"20\"}}', '21-11-2022', '07:00PM-07:30PM', '', 'Want muslim boy', '1343.2', 'Cash On Service', 'pending', '', 1, 100, '2022-11-18 15:40:59', 'Manu Dheeraj, 393 Enter From Gate 3, Gagan vihar, Delhi, Delhi - 110051', 1102, 'e881854aed3fec87076ccbb5850998f0', 'Cash On Service Delivery', 100214, '8860650135', 1353, 'false', NULL, NULL, 'true', 'false', NULL, 'we not provide Muslim candidates ', '2022-11-21 21:57:17', 'false', NULL, NULL, '64.00'),
(1149, 'Aniruddha Kulkarni', 'aniruddhakulkarni.u@gmail.com', '9043257171', '{\"1150\":{\"cart_id\":\"1150\",\"service_id\":\"1107\",\"session_id\":\"632307d8d14a4e66661974fb254b7b0d\",\"quantity\":\"1\",\"amount\":\"1499\",\"offers\":\"20\"}}', '18-11-2022', '06:30PM-07:00PM', '', '', '1259.2', 'Cash On Service', 'completed', '', 1, 100, '2022-11-18 16:35:09', 'Aniruddha Kulkarni, P 304 Homes 121 Sector 121, Sector 121, Noida, Uttar Pradesh - 201301', 1103, '0f8767ec6b24d0169d2cee744d4531ef', 'Cash On Service Delivery', 100215, '9043257171', 1308, 'true', 500012, 'DEEPAK KUMAR VERMA', 'false', 'false', NULL, NULL, NULL, 'false', NULL, NULL, '60.00'),
(1150, 'GD', 'gyan.darshan1994@gmail.com', '9658334646', '{\"1372\":{\"cart_id\":\"1372\",\"service_id\":\"1113\",\"session_id\":\"b16182060c46761790645a975b6bc105\",\"quantity\":\"1\",\"amount\":\"1450\",\"offers\":\"20\"}}', '18-11-2022', '06:30PM-07:00PM', '', '', '1218', 'Cash On Service', 'accepted', '', 1, 100, '2022-11-18 16:52:40', 'GD, Marriott 1805, urbtech Xavier, Noida 168, Noida 168, Noida, Uttar Pradesh - 201306', 1096, 'b16182060c46761790645a975b6bc105', 'Cash On Service Delivery', 100216, '9658334646', 1333, 'true', 500007, '  sunil chandel', 'false', 'true', 'Urgent work', NULL, '2022-11-18 17:27:30', 'false', NULL, NULL, '58.00'),
(1151, 'Rohit', 'rohitchauhan99@outlook.com', '9971932756', '{\"1401\":{\"cart_id\":\"1401\",\"service_id\":\"1070\",\"session_id\":\"9314f97be6864aa30b55922e51b7deb8\",\"quantity\":\"1\",\"amount\":\"2299\",\"offers\":\"25\"}}', '19-11-2022', '02:30PM-03:00PM', '', 'Send at 13:30', '1793.25', 'Cash On Service', 'accepted', '', 1, 100, '2022-11-19 12:10:08', 'Rohit , Flat 8 4th floor D1/45 Mansa ram park, Dwarka mod , Near metro pillar number 768, NEW DELHI, Delhi - 110059', 1106, '9314f97be6864aa30b55922e51b7deb8', 'Cash On Service Delivery', 100217, '9971932756', 1359, 'true', 500011, 'Naveen Rana', 'false', 'true', 'Urgent work', NULL, '2022-11-19 12:28:18', 'false', NULL, NULL, '69.00'),
